436	Flame retardant chemicals added to furniture, mattresses, carpeting, electronics and vehicles may affect social behavior in young children leading to behaviors such as aggression, defiance, hyperactivity, inattention and bullying, finds an OSU study published today in Environmental Health.	14437
437	A single U.S. shale oil field is responsible for much of the past decade's increase in global atmospheric levels of ethane. Researchers found that the Bakken Formation, an oil and gas field in North Dakota and Montana, is emitting roughly 2% of the globe's ethane, or about 250,000 tons per year.	14430
438	A study which followed 180 pre-term infants from birth to age 7 found that babies who were fed more breast milk within the first 28 days of life had had larger volumes of certain regions of the brain at term equivalent and had better IQs, academic achievement, working memory, and motor function.	14423
439	"""Hydra is a genus of tiny freshwater animals that catch and sting prey using a ring of tentacles. But before a hydra can eat, it has to rip its own skin apart just to open its mouth."""	14384
440	Medical marijuana laws may reduce painkiller overdoses -- States that have legalized marijuana for managing chronic pain have significantly fewer deaths from prescription painkiller overdoses each year, according to a new study published Monday in JAMA Internal Medicine	14361
441	The First White Laser. Scientists and engineers at Arizona State University have created the first lasers that can shine light over the full spectrum of visible colors.	14345
442	It’s not just Flint: Poor communities across the country live with ‘extreme’ polluters - he highest polluting facilities were also more likely to be located in proximity to poor and minority neighborhoods.	14323
443	Black hole breaks records, swallows up scientific theory. Supermassive black hole at centre of a quasar is 12 billion times more massive than the sun	14303
444	Chimpanzees in the wild 'talk' to each other about their favorite fruits and the trees where they can be found.	14216
445	Just 43 percent of 15-year-olds sleep 7 or more hours, down from 72 percent in the 1990s	14209
446	"Children born in the 41st week of pregnancy - which is considered ""late-term"" - have better test scores and are more likely to be classified as gifted in elementary and middle school, compared with children born ""full-term,"" that is, at 39 or 40 weeks."	14194
447	Virtually all of Earth's life-giving carbon could have come from a collision about 4.4 billion years ago between Earth and an embryonic planet similar to Mercury	14150
448	Scientists unearth fossil of a 6.2-million-year-old otter. It is among the largest otter species on record.	14148
449	Antibacterial Soap No Better at Killing Germs Than Regular Soap	14145
450	Tomorrow, we're going to talk about racism in science, please be aware of our rules, and expectations.	14133
451	Astronomers have developed a new, highly accurate method of measuring the distances between stars, which could be used to measure the size of the galaxy, enabling greater understanding of how it evolved.	14101
452	84% of American women groom pubic hair with 62% opting for complete removal	14080
453	Scientists discover magma buildup under New Zealand town	14069
454	"Scientists In south China have discovered teeth belonging to modern humans that date to at least 80,000 years ago. This is 20,000 years earlier than the widely accepted ""Out of Africa"" migration that led to the successful peopling of the globe by Homo sapiens."	14068
455	Large scale study says group nature walks linked with significantly lower depression and perceived stress, enhanced mental well-being	14068
456	Scientists have developed a working laboratory demonstrator of a lithium-oxygen battery which has very high energy density, is more than 90% efficient, and, to date, can be recharged more than 2000 times.	14070
457	Researchers were able to correctly identify autism in 80 percent of their subjects by analysing how long they spent focussing on the social and non-social aspects of a series of images and videos.	14057
458	Children born to obese parents are more likely to fail developmental tests for motor skills, social competence, or cognitive problem-solving.	14041
459	3.3-million-year-old stone tools unearthed in Kenya pre-date those made by Homo habilis (previously known as the first tool makers) by 700,000 years	14011
460	Electronic cigarette aerosols and copper nanoparticles induce mitochondrial stress and promote DNA fragmentation in lung fibroblasts	13981
461	"""Copper kills everything"": A Copper Bedrail Could Cut Back On Infections For Hospital Patients"	13968
462	"Life ""not as we know it"" might be possible on Titan"	13937
463	Counter to contrarian claims, new research finds that not only did significant global-scale tropospheric warming occur within the last 18 years, but also that the average of 37 climate models is in close agreement with satellite data.	13916
464	NASA AMA: We are expanding the first human-rated expandable structure in space….AUA!	13905
465	"College grads in the 90s moved to cities with fast-growing ""smart"" industries like tech. But now, US college grads choose cities with the biggest labor markets and the best chances of landing literally any job."	13896
466	The Eastern US could get a third of its power from renewables within 10 years. Theoretically. - It will require space, money, and transmission lines, but no new advances in energy storage or demand management.	13886
467	Autistic brains are more symmetrical. Study suggests that in children and adolescents with autism, the brains’ hemispheres are less likely to specialize in one way or another. Findings give insight into how brain development in autistic people contributes to the disorder’s cognitive characteristics.	13893
468	"Researchers recorded the brain activity of 50 people while they looked at a series of 500 images. They found that participants' brains reacted differently to each image, enough that a computer system was able to identify each volunteer's ""brainprint"" with 100 percent accuracy."	13868
469	Dog DNA study reveals the extraordinary journey of man's best friend - Descended from the grey wolf, domesticated dogs have been companions to humans for about 33,000 years, a genetic study has shown.	13811
470	Anxious Parents Can Transmit Anxiety to Children, Twin Study Shows. Parental and offspring anxiety and neuroticism appears to be environmental rather than genetic. Children learn anxious behaviors from their parents rather than inheriting anxiety genetically.	13805
471	With only about one-sixth of the original coral cover left, most Caribbean coral reefs may disappear in the next 20 years, primarily due to the loss of grazers in the region. The damage can be reversed, however.	13787
472	"Tibetans and Sherpas inherited high-altitude ""super-athlete"" allele of gene EPAS1 from an extinct species of humans, the Denisovians."	13761
473	/r/Science is NOT doing April Fool's Jokes, instead the moderation team will be answering your questions, AMA.	13762
474	3D embryo atlas reveals human development in unprecedented detail. Digital model will aid vital research, offering chance chance to explore intricate changes occurring in the first weeks of life.	13761
475	One in three two-year-olds in United States have not received all recommended childhood vaccines	13747
476	Science AMA series: Hi, I'm Sonia Vallabh and this is Eric Minikel. We're a husband-wife science team on a quest to cure my own genetic disease before it kills me. AUA!	13722
477	July 2015 was warmest month ever recorded for the globe.	13701
478	Superconductivity recorded at a record high temperature of 203K (-70°C). Hydrogen Sulfide was able to conduct electricity with zero resistance at this temperature.	13686
479	Storks give up on winter migration in favor of junk food	13662
480	Believing in your child leads to better grades, and not believing in them leads to lower grades. Amounts to a .21 GPA swing.	13651
481	Chronic sleep deprivation suppresses the immune system, based on a study that examined 11 pairs of identical twins with different sleep patterns. The immune system functions best when it gets enough sleep, and 7 or more hours of sleep is recommended for optimal health.	13640
482	Activity of Huntington's disease gene curbed for 6 months in mice	13633
483	Scientists have developed a polymer sphere that delivers a molecule to bone wounds that tells cells already at the injury site to repair the damage. Using it to introduce the microRNA molecule into cells elevates the job of existing cells to that of injury repair	13631
484	New Virus Breaks The Rules Of Infection: A team at the U.S. Army Medical Research Institute of Infectious Diseases has found a mosquito virus that's broken up into pieces. And the mosquito needs to catch several of the pieces to get an infection.	13605
485	Scientists confirm a structural similarity found in both human cells and neutron stars	13548
486	An unusual object about 90 million light-years from Earth might be a supermassive black hole kicked out of its home galaxy during a collision with another galaxy. If so, it would be the first evicted black hole to be confirmed as such.	13547
487	Guilt-prone people are highly skilled at recognising other people's emotions	13529
488	New study confirms that smoking causes emphysema due to incomplete combustion of insoluble nanoparticulate of carbon and the longer you smoke the worse it gets	13525
489	A simple one-hour therapy session has helped to cure 73% of people suffering from acute insomnia, according to a new study from Northumbria University released today.	13517
490	Scientists discover new human-like species in South Africa cave which could change ideas about our early ancestors	13508
491	Fast food is just as effective as exercise supplements at helping athletes recover after a workout. In a study, there were no differences in muscle glycogen levels and subsequent performance.	13511
492	When scientists falsify data, they try to cover it up by writing differently in their published works. A study of 253 scientific papers retracted for fraudulent data identifies the writing patterns associated with obfuscation.	13499
493	Unexpected Risks Found In Editing Genes To Prevent Inherited Disorders	13492
494	Researchers compile gluten-free food database, find that gluten-free foods are over twice as expensive and don't offer additional health benefits for non-celiac consumers.	13455
495	A group of 350 genetically pure bison found in Utah	13438
496	Peanuts reduce risk of cancer, dementia, heart attacks and diabetes, according to a new study. People who ate 10g of nuts per day were less likely to die from major diseases, including respiratory disease, neurodegenerative disease, diabetes, cancer and cardiovascular disease.	13391
497	Scientists have developed a molecule that reverses antibiotic resistance in multiple strains of bacteria at once by disabling the enzyme known as New Delhi Metallo-beta-lactamase (NDM-1), which makes bacteria resistant to carbapenems (our 'last resort' drugs), in vitro and in vivo in mice.	13378
498	Study finds sexting by adolescents is not a predictor of later risky sexual behavior, may be normal part of sexual development.	13382
499	Largest ever longitudinal twin study of adolescent cannabis use finds no relationship between even heavy use and IQ decline.	13317
500	Almost 6,500 women between 65 and 80 years old self-reported their caffeine consumption over 10 years, and the ones drinking more than 261 milligrams of caffeine each day showed a 36 percent reduced risk of dementia, according to a study.	13299
501	3D printed teeth to keep your mouth free of bacteria.	13286
502	Lack of stimulation in the workplace and dirty working environment has long-term cognitive effects on employees	13272
503	Yale study finds state youth e-cig bans lead to increased traditional cigarette smoking	13260
504	MIT researchers create new form of matter - Supersolid and superfluid at the same time	13254
505	Nanoengineers at the University of California have designed a new form of tiny motor that can eliminate CO2 pollution from oceans. They use enzymes to convert CO2 to calcium carbonate, which can then be stored.	13251
506	The bacteria in our gut manipulate our minds by signaling which dietary choices we should make	13232
507	Men who become fathers experience weight gain and an increase in body mass index according to a new, large-scale study that tracked more than 10,000 men over a 20-year period. Men who didn't become dads actually lost weight over the same time period.	13229
508	The fall of religion in America. More Americans than ever believe the bible “is an ancient book of fables, legends, history, and moral precepts recorded by men” according to a nationally presentative survey.	13201
509	For teen girls, abortion linked to better outcomes vs. giving birth	13172
510	Bacteria from bees possible alternative to antibiotics: 13 lactic acid bacteria found in the honey stomach of bees have shown promising results. The group of bacteria counteracted antibiotic-resistant MRSA in lab experiments. The bacteria, mixed into honey, has healed horses with persistent wounds	13146
511	Inhalation of one marijuana cigarette per day over a 20-year period is not associated with adverse changes in lung health	13140
512	Obesity has rapidly increased in young rural Chinese, a study has warned, because of socioeconomic changes.	13137
513	Depression is more than a mental disorder: It affects the whole organism	13107
514	A pet dog may protect your child from childhood anxiety, according to research published by the Centers for Disease Control and Prevention.	13100
515	A cardboard centrifuge separates blood cells from plasma in 2 minutes. Based on an ancient toy, it costs 20 cents and weighs just 2 grammes	13087
516	Scientists accidentally create scalable, efficient process to convert CO2 into ethanol	13089
517	A complete picture of the areas that the immune system attacks to cause type 1 diabetes has finally been revealed by scientists.	13069
518	Sleep deprivation can increase the risk of developing false memories	13046
519	Study on twenty obese individuals, shows that if an overweight person is able to maintain an initial weight loss – in this case for a year – the body will eventually ‘accept’ this new weight and thus not fight against it, as is otherwise normally the case when you are in a calorie-deficit state.	13017
520	91% of patients who survive opioid overdose are prescribed more opioids	13005
521	Men who reported taking muscle-building supplements, such as pills and powders with creatine or androstenedione, reported a significantly higher likelihood of having developed testicular cancer than men who did not use such supplements, according to a new study in the British Journal of Cancer.	12979
522	DNA from Inca boy sacrificed 500 years ago shows how humans spread to South America	12971
523	Study: Circumcision does not reduce penis sensitivity. In tests for responses to pain, heat, and stimulation, no major difference was found between men who are circumcised and those who are not.	12946
524	Study: People four times more likely to order dessert and ordered 17.65% more alcoholic drinks when their server is overweight.	12955
525	Poor Pregnancy Diet Linked To ADHD: Too Much Sugar, Fat Affects Unborn Baby	12928
526	A new study from the University of Pennsylvania has found that 91% of health-related webpages relay sensitive information to third parties including Google, Facebook and even data brokers such as Experian.	12912
527	Researchers have for the first time managed to create a hologram using neutron beams instead of lasers. The new neutron beam holograms reveal details about the insides of solid objects, a feat impossible for laser holograms.	12911
528	Children who received general anesthesia for surgery before age 4 had diminished language comprehension, lower IQ and decreased gray matter density in posterior regions of their brain, according to a new study	12890
529	Scientists discover why some people can thrive on less sleep than others. A particular gene variant is responsible, and those with it can also handle extended periods of sleeplessness better.	12894
530	International report confirms: 2014 was Earth’s warmest year on record	12858
531	Ibuprofen use leads to extended lifespan in several species, study shows	12868
532	Tuberculosis-resistant cows developed for the first time using CRISPR technology	12850
533	Science AMA Series: I'm Fred Perlak, a long time Monsanto scientist that has been at the center of Monsanto plant research almost since the start of our work on genetically modified plants in 1982, AMA.	12842
534	Our ability to run for many hours is thought to be key to our lack of hair and our weird lack of hair may be the key to our success.	12830
535	An office enriched with plants makes staff happier and boosts productivity by 15 per cent	12791
536	The octopus can see with its skin - Octopus skin contains a light-sensitive pigment found in eyes, suggesting that these clever cephalopods can “see” without using their eyes.	12728
537	Reddit “Ask a Rapist” Thread Is Now the Subject of a Research Study on the Self Justifications of Rapists	12730
538	Scientists developed a microscope that uses AI in order to locate cancer cells more efficiently. The device uses photonic time stretch and deep learning to analyze 36 million images every second without damaging the blood samples	12702
539	A huge monument has been discovered buried under the sands at the Petra World Heritage site in southern Jordan. The large platform is about as long as an Olympic swimming pool and twice as wide. Researchers say it is unlike any other structure at the ancient site.	12688
540	Connecticut’s permit to purchase law, in effect for 2 decades, requires residents to undergo background checks, complete a safety course and apply in-person for a permit before they can buy a handgun. Researchers at Johns Hopkins found it resulted in a 40 percent reduction in gun-related homicides.	12685
541	Scientists discover neural mechanisms in mouse brains that indicate that we actively forget as we learn	12675
542	Removing a Congressional ban on needle exchange in D.C. prevented 120 cases of HIV and saved $44 million over 2 years	12656
543	A hard drive made from DNA preserved in glass could store data for over 2 million years	12654
544	Cancer's 'Frankenstein' DNA mystery solved: The creation of a 'Frankenstein' chromosome that steals the DNA it needs to grow and survive has been detailed for the first time in research led by Australian scientists.	12645
545	Scientists have found that two proteins called SERINC5 and SERINC3 greatly reduce the virulence of HIV-1 by blocking the ability of the virus to infect new cells	12629
546	Certain wavelengths of visible light are nearly 100% lethal to insects. Blue LEDs could be a new form of pest control.	12623
547	Acoustic physicists design a metasurface that is a thin, near perfect absorber of sound and efficiently converts sound energy to electricity with 23% efficiency	12602
548	Paleontology student has discovered an Ornithomimus dinosaur with preserved tail feathers and skin tightens linkages between dinosaurs and birds	12599
549	14,000-year-old bone found in Red Deer Cave, China, points to archaic human species	12599
550	Giraffes spend their evenings humming to each other	12567
551	Teenagers and young adults who identify as transgender have hormone levels consistent with their birth gender, according to a paper.	12503
552	Electronic energy meters’ false readings almost six times higher than actual energy consumption	12423
553	New Vaccine Developed to Prevent Lyme Disease	12419
554	Sperm from obese men carry a distinct epigenetic signature compared to lean men - possible explanation of why children of obese fathers are themselves more predisposed to obesity.	12358
555	Male doctors are more likely to have legal action taken against them than female doctors	12354
556	The world’s most popular banana could go extinct: That's the troubling conclusion of a new study published in PLOS Pathogens, which confirmed something many agricultural scientists have feared to be true.	12340
557	"""Years of smoking pot may have an effect on a person's verbal memory, which is the ability to remember certain words, a new study finds"""	12320
558	Smoking marijuana more than once a week may lower men's sperm counts by about a third, according to a new study.	12310
559	Survey of over 13,500 high school students finds exercise 4 or more days per week associated with 23% reduction in suicidal ideation and attempts among bullied students.	12303
560	Researchers have discovered that a rabbit virus can deliver a one-two punch, killing some kinds of cancer cells while eliminating a common and dangerous complication of bone marrow transplants.	12305
561	Research shows that chemotherapy can lead to excessive mind wandering and an inability to concentrate. Dubbed ‘chemo-brain,’ the negative cognitive effects of the cancer treatment have long been suspected, but the study is the first to explain why patients have difficulty paying attention.	12303
562	New study finds a hot spot in the atmosphere. This result is in very close agreement with climate computer models and it contradicts the view that there is a slowdown in climate change.	12296
563	Chemists Confirm the Existence of New Type of Bond	12269
564	Mantis shrimps can see cancer, and scientists have now created a camera that does the same	12261
565	Dispersants did not help oil degrade in BP spill, a new study suggests.	12255
566	Researchers are challenging the intake of vitamin D recommended by the US Institute of Medicine, stating that, due to a statistical error, their recommended dietary allowance for vitamin D underestimates the need by a factor of 10.	12211
567	Guinea Worm is on the verge of extinction, if successful will make it the third parasite after smallpox and rinderpest to become extinct due to human efforts.	12209
568	A Giant burst of Radio Waves being tracked by Scientists	12125
569	"Johns Hopkins University study reveals that American combat veterans from Iraq and Afghanistan with undiagnosed brain injuries often experience a ""downward spiral"" in which they downplay their wounds and become detached from friends and family before finally seeking help"	12114
570	Epstein-Barr virus infects human cells and makes them impossible to kill by the immune system. Now researchers have designed an artificial protein that enters infected cells, binds to virus, and activates the immune system to kill the infected cell.	12092
571	A team of German and American scientists recently announced a organ transplant breakthrough. The researchers were able to keep a pig heart beating inside a baboon for more than two years, using genetic engineering and immunosuppression drugs to keep the baboon from rejecting the pig heart.	12071
572	"Study suggests ""vaping"" in high school is capturing kids who ordinarily wouldn't smoke"	12075
573	A new study, based on reports from more than 10,000 individuals, has found that physical activity, whether or not it is classified as exercise, can have a positive effect on emotional well-being.	12057
574	Scientists have discovered a simple way to cook rice that dramatically cuts the calories	12052
575	A rare strain of MRSA originally from India has been detected in a Paris airport bathroom. The researchers believe that international travelers are helping to spread antibiotic resistance around the globe.	12030
576	A new study suggests those with psychopathic tendencies are often very creative, suggesting the ability to think boldly and ruthlessly can help with the development of great ideas.	12030
577	The use of antibiotics in young children may alter the natural populations of gut microbes in a way that leaves them predisposed to weight gain and asthma in later childhood	12020
578	Study on fish affected by the Deepwater Horizon spill identifies a compound released from oil as a key factor in disrupting heart function. This compound is common in urban air pollution, suggesting it may be a major worldwide cause of vertebrate cardiac dysfunction.	12015
579	Science AMA Series: We are evolution researchers at Harvard University, working on a broad range of topics, like the origin of life, viruses, social insects, cancer, and cooperation. Today is Charles Darwin’s birthday, and we’re here to talk about evolution. AMA!	12014
580	Chemists discover key reaction mechanism behind the highly touted sodium-oxygen battery which could pave the way for development of the so-called holy grail of electrochemical energy storage	11992
581	No asthma found in one third of adults who were diagnosed within the past 5 years, according to JAMA study	11966
582	Overweight children don't know they're overweight. Approximately 81% of overweight boys and 71% of overweight girls believe they are about the right weight.	11966
583	A Single Concussion May Triple the Long-Term Risk of Suicide	11956
584	Scientists in California have found that earthquakes can occur much deeper below the Earth’s surface than originally believed, a discovery that alters their understanding of seismic behavior and potential risks.	11959
585	California's drought is the worst in 1,200 years, evidence suggests	11938
586	New study concludes that there is 99.999% certainty humans are driving global warming	11923
587	Obesity is three times as deadly for men than women	11924
588	A study found that LGBTQ students attending high schools with gay-straight alliances reported significantly fewer incidences of bullying based on sexual orientation or gender expression and had a greater sense of personal safety compared to students in schools without GSAs.	11917
