0	Seven Earth-sized planets found orbiting an ultracool dwarf star are strong candidates in the search for life outside our solar system.	82801
1	Science Ama Series: I am Stephen Hawking, theoretical physicist. Join me to talk about making the future of technology more human, reddit. AMA!	79240
2	Adolescents who smoke marijuana as early as 14 do worse by 20 on some cognitive tests and drop out of school at a higher rate than non-smokers. But if they hold off until age 17, they're less at risk, and performed equally well as adolescents who did not use cannabis.	72821
3	State same-sex marriage legalization is associated with 7% drop in attempted suicide among adolescents, finds Johns Hopkins study.	64444
4	Oxford team achieves a quantum logic gate with record-breaking 99.9% precision, reaching the benchmark required to build a quantum computer	57685
5	Study of 95,000 children finds no link between MMR vaccines and autism, even within high-risk populations	53994
6	Delaying school start times could help teenagers sleep better giving them a better chance for success. Researchers have found that students from schools that started earlier slept less, were less likely to meet the national sleep recommendations for their age & were more often tired in the morning.	52539
7	New Ebola vaccine shows 100% effectiveness in a study of nearly 6,000 patients (p-value 0.0033)	52487
8	Study uncovers 6,648 spills from fracking in just four states.	50401
9	Plain packets help smokers quit by killing brand identities - Making all cigarette packets look the same reduces the positive feelings smokers associate with specific brands and encourages quitting, Australian research shows.	49973
10	"Dragonfly wings naturally kill bacteria. At the molecular scale, they are composed of tiny ""beds of nails"" that use shear forces to physically rip bacteria apart."	49368
11	Doctors don’t just “get over” rude treatment from patients, research suggests. In simulations with an angry parent, the performance of pediatricians suffered dramatically. The findings reinforce past research that rudeness has negative effects on medical performance.	48907
12	Children get more satisfaction from relationships with their pets than with their brothers or sisters, according to new research from the University of Cambridge.	47827
13	Killer whales go through menopause to avoid competition with their daughters. This sheds light on why menopause exists at all.	47021
14	People find it hard to maintain eye contact when talking, possibly because the dual task of maintaining eye contact while also racking the brain for a word is just too demanding, so the brain pushes for breaking eye contact to focus exclusively on finding a word that will fulfill the obligation.	46450
15	More than 60% of people surveyed in a new study supported marijuana legalization because they agreed with arguments saying it would increase tax revenues, create a profitable new industry, reduce prison crowding and lower the cost of law enforcement, finds Cornell University researchers.	46178
16	When political beliefs are challenged, a person’s brain becomes active in areas that govern personal identity and emotional responses to threats, USC researchers find	45704
17	All four clones of Dolly the sheep are aging healthily, a Nature study has found	45493
18	Operating system and a film stored on DNA, and recovered with no errors.	44989
19	Scientists have added a one-atom thick layer of graphene to solar panels, which enables them to generate electricity from raindrops	44245
20	"Mass killings and school shootings spread ""contagiously."" Not dependent on location, leading researchers to believe that national media coverage of a mass shooting might play a role"	43966
21	Cheetahs heading towards extinction as population crashes - The sleek, speedy cheetah is rapidly heading towards extinction according to a new study into declining numbers. The report estimates that there are just 7,100 of the world's fastest mammals now left in the wild.	42056
22	Mercury found to be tectonically active, joining the Earth as the only other geologically active planet in the Solar System	41780
23	A new study has revealed that it's general exchanges of words and signs of affection following sex that directly cause increased long-term happiness and more life satisfaction in couples who have sex at least once a week.	41036
24	Fewer children visited emergency rooms for asthma problems in the three years after cities banned indoor smoking than in the three years before, according to a new study by Brown University School of Public Health.	40897
25	"Geologists have found a new fault line under the San Francisco Bay. It could produce a 7.4 quake, effecting 7.5 million people. ""It also turns out that major transportation, gas, water and electrical lines cross this fault. So when it goes, it's going to be absolutely disastrous,"" say the scientists"	39788
26	When preschoolers spend time around one another, they tend to take on each others’ personalities, indicates a new study by Michigan State University researchers, which suggests personality is shaped by environment and not just genes.	39379
27	99-million-year-old feathered dinosaur tail captured in amber discovered.	38500
28	Spanking children increases the likelihood of childhood defiance and long-term mental issues. The study in question involved 160,000 children and five decades of research	37776
29	Curiosity Rover Drills Into Mars Rock, Finds Water...and, in that same sample, the first discovery of organic compounds.	37771
30	Study: Baby boomers don't work harder than younger generations	37166
31	DNA clues to why woolly mammoth died out - The last woolly mammoths to walk the Earth were so wracked with genetic disease that they lost their sense of smell, shunned company, and had a strange shiny coat.	36991
32	After Texas defunded Planned Parenthood, low-income women lost access to highly effective contraception and Medicaid births increased 27%	36965
33	Repeating radio signals coming from a mystery source far beyond the Milky Way have been discovered by scientists. While one-off fast radio bursts (FRBs) have been detected in the past, this is the first time multiple signals have been detected coming from the same place in space.	36952
34	People who regularly take photos of themselves, or selfies, tend to overestimate their attractiveness and likability to a greater extent, and are seen as more narcissistic by independent observer.	36910
35	People living in neighbourhoods with more birds, shrubs and trees are less likely to suffer from depression, anxiety and stress.	36285
36	Use of body-worn cameras sees complaints against police ‘virtually vanish’, study finds	35957
37	Potential new vaccine blocks every strain of HIV	34753
38	48-million-year-old fossil reveals an insect inside a lizard inside a snake—just the second time ever that three trophic levels have been seen in one vertebrate fossil.	34460
39	The abortion rate is at an all-time low — and better birth control is largely to thank. Use of contraception, especially the most effective methods like IUDs and implants, did much more to reduce abortion rates than restrictive laws.	34426
40	Earth's oceans are warming 13% faster than thought, and accelerating	34353
41	With a 10-day supply of opioids, 1 in 5 become long-term users	33921
42	First new antibiotic in 30 years discovered in major breakthrough	33604
43	Having teenagers care for lifelike baby dolls doesn't reduce teen pregnancy -- in fact, it may increase it	33451
44	NASA Announcement Mega Thread: NASA Reports flowing water on Mars	33144
45	The rhythm of breathing creates electrical activity in the human brain that enhances emotional judgments and memory recall, which depend critically on whether you inhale or exhale and whether you breathe through the nose or mouth, Northwestern Medicine scientists have discovered for the first time.	33103
46	Enceladus, Saturn's 6th largest moon, has a warm ocean with hydrothermal vents. This is the first ever discovered outside of Earth, and makes for the most habitable off-world environment ever found.	33057
47	Study confirms that the emerald sea slug has gained the ability to photosynthesize like a plant by incorporating a photosynthesis gene from the algae it eats into its chromosomes.	32852
48	Fifty hospitals in the US are overcharging the uninsured by 1000%, according to a new study from Johns Hopkins.	32566
49	Chemotherapy followed by stem cell transplantation has fully halted clinical relapses and the development of new brain lesions in 23 of 24 patients with multiple sclerosis (MS) for a prolonged period without the need for ongoing medication. Results of Phase II trial published in The Lancet.	32343
50	Declines in Teen Pregnancy Risk Entirely Driven by Improved Contraceptive Use	32287
51	Harvard's soft exosuit, a wearable robot, lowered energy expenditure in healthy people walking with a load on their back by almost 23% compared to walking with the exosuit powered-off. Such a wearable robot has potential to help soldiers and workers, as well as patients with disabilities.	32204
52	Silkworms Spin Super-Silk After Eating Carbon Nanotubes and Graphene	32158
53	Giraffes are not a single species as previously thought, but rather four distinct species, DNA analysis reveals.	32156
54	78% of the children in a study who had ADHD as a child, no longer had the disorder when they were 18. Their ADHD resolved over time.	32006
55	A pregnant Tyrannosaurus rex has been found, shedding light on the evolution of egg-laying as well as on gender differences in the dinosaur.	31965
56	Divers pull 1,000 year old tortoise skeleton from a blue hole in the Bahamas with much of its DNA intact. It is the first sample of ancient DNA retrieved from an extinct tropical species and it could provide insight into the history of the Caribbean tropics and the reptiles that dominated them.	31896
57	Drawing on research in economics, psychology and sociology, study shows how people select their own reality by deliberately avoiding information that threatens their happiness and wellbeing and selectively direct attention to information that affirms what they believe or reflects favorably upon them	31818
58	Study finds that more than 70 minutes of homework a day is too much for adolescents	31786
59	As more states legalize marijuana, adolescents’ problems with pot decline. Fewer adolescents also report using marijuana.	31753
60	Top students more likely to smoke pot, drink alcohol, study says	31542
61	An injection of a protein called IL-33 reverses Alzheimer's-like symptoms and cognitive decline in mice, restoring their memory and cognitive function to the same levels as healthy mice in the space of one week.	31298
62	"Academia is sacrificing its scientific integrity for research funding and higher rankings in a ""climate of perverse incentives and hypercompetition"""	31278
63	Harvard Study: Biggest Factor in Divorce is Husband's Employment Status	31112
64	Honeybees let out a ‘whoop’ when they bump into each other - A vibrational pulse produced by honeybees, long thought to be a signal to other bees to stop what they are doing, might actually be an expression of surprise.	31098
65	Antidepressants plus blood thinners cause brain cancer cells to eat themselves in mice - Mouse lifespan doubled with the drug combination therapy, while either drug alone had no effect.	30842
66	Study finds Lumosity has no increase on general intelligence test performance, Portal 2 does	30805
67	Study finds association between eating hot peppers and decreased mortality	30713
68	Researchers have identified a unique “breathprint” for 17 different diseases, such as kidney cancer or Parkinson’s disease, and have designed a device that screens breath samples with 86% accuracy using an array of nanoscale sensors and analyzing the results with artificial intelligence techniques.	30597
69	King Tut's dagger blade made from meteorite, study confirms.	30511
70	Men’s hidden fears about body fat are fuelling gym attendance motivated by feelings of guilt and shame rather than a desire to build muscle, new research has shown.	30494
71	Algae has been genetically engineered to kill cancer cells without harming healthy cells. The algae nanoparticles, created by scientists in Australia, were found to kill 90% of cancer cells in cultured human cells. The algae was also successful at killing cancer in mice with tumours.	30328
72	Scientists 'unexpectedly' stumble upon a vaccine that completely blocks HIV infection In monkeys - clinical trials on humans planned!	30265
73	When given two scenarios: one in which an individual reacts to his girlfriend’s infidelity by beating her, and the other, by beating her cat, participants judged that the cat beater had worse moral character than the woman beater, even though the act of beating a woman was judged to be more immoral.	30254
74	No Difference in Behavioral Issues In Children Adopted By LGBT Parents When Compared To Children Adopted By Heterosexual Parents.	30184
75	Depression in Young People Affects the Stomach. Anxiety effects the Skin.	29992
76	In a world first, a quadriplegic man can once again move his fingers after a chip was implanted in his brain.	29948
77	Major study confirms that Earth is currently witnessing the start of a mass extinction event the likes of which have not been seen for at least 65 million years. It is being precipitated by human actions over past 500 years.	29839
78	95% of CO2 Injected into Basaltic Rock Mineralizes Within 2 Years, Permanently Removing it from Atmopshere	29330
79	Life expectancy will soon exceed 90 years for the first time. The Lancet study shows a significant rise in life expectancy in most of the 35 developed countries studied, except in the US, where life expectancy is predicted to rise more slowly due to obesity, homicides and lack of equal access.	29227
80	Use of cannabis during pregnancy is linked to low birthweight and the need for intensive care, reveals an analysis of the available evidence	29164
81	New study has detected a decline in the amount of dissolved oxygen in oceans around the world — a long-predicted result of climate change that could have severe consequences for marine organisms if it continues	29138
82	An Aurora Shift Confirms Jupiter's Moon Ganymede Has An Ocean	28930
83	Tasmanian devils show evidence of a new evolutionary resistance to facial tumors that have devastated populations to the brink of extinction, Nature Comm study finds.	28908
84	The sugar industry began funding research that cast doubt on sugar's role in heart disease — in part by pointing the finger at fat — as early as the 1960s, according to an analysis of newly uncovered documents.	28751
85	Humans have triggered the last 16 record-breaking hot years experienced on Earth (up to 2014), with the new research tracing our impact on the global climate as far back as 1937. The findings suggest that without human-induced climate change, recent hot summers and years would not have occurred.	28672
86	Religion in the United States is declining and mirroring patterns found across the western world, according to new study	28491
87	Appealing to teens' impulse to rebel can curb unhealthy eating. When healthy eating was suggested as a way to take a stand against manipulative and unfair practices of the food industry, 8th graders were more likely to chose healthier food.	28424
88	New liquid crystal could make TVs three times sharper. Researchers have developed a new blue-phase liquid crystal that could enable televisions, computer screens, and other displays to pack more pixels into the same space while also reducing the power needed to run the device.	28352
89	Fijian ants began cultivating fruit millions of years ago, gathering seeds, then seeking out fissures in tree bark to plant them in before fertilizing them with their feces.	28334
90	40 years ago Stephen Hawking showed information can be lost from the universe when black holes evaporate away. No one has resolved the paradox, which undermines determinism. In a new paper, Hawking points to a potential solution	28286
91	Long visits to nature linked to improved mental health, study finds	28247
92	Scientist discovered that by running liquid chocolate through an electric field, they were able to remove up to 20% of the fat while making the end product tastier.	28021
93	Engineers create specially grown, 'superhemophobic' titanium surface that's extremely repellent to blood, which could form the basis for surgical implants with lower risk of rejection by the body.	27988
94	Humpback whales around the globe are mysteriously rescuing animals from orcas	27674
95	Brontosaurus is officially a dinosaur again. New study shows that Brontosaurus is a distinct genus from Apatosaurus	27441
96	Men who can tell a good story are seen as more attractive and higher status	27430
97	Study shows boys outscore girls on reading tests if told the tests were a game. But boys scored significantly lower than girls when told the tests were assessments of their reading skills. The study was relatively small and involved children who were still learning how to read.	27396
98	When compared with a single cigarette, one hookah session delivers approximately 125 times the smoke, 25 times the tar, 2.5 times the nicotine and 10 times the carbon monoxide.	27261
99	Study finds that because teens tend to be night owls who regularly go to bed late, they tend to be both sleepier during the day and have more trouble with self-regulation, regardless of how much sleep they actually report getting. Findings support later start times for middle and high schools.	27265
100	Viruses may have evolved to hit men hard but go easy on women. One explanation is that women are more valuable hosts. Women can pass infections to their children during pregnancy, birth, and breastfeeding, so there’s an evolutionary pressure on viruses to be less harmful to them.	27228
101	One of World's Most Dangerous Supervolcanoes Is Rumbling	27179
102	A behavioral therapy program called Becoming a Man (BAM) for economically disadvantaged youth in Chicago reduced the participants' violent-crime arrests by 45–50%, and increased graduation rates by 12–19%.	27082
103	Scientists have found a human protein that blocks Zika virus replication and prevents brain cell death	27054
104	After six months of treatment with repeated muscle stimulation a tetraplegic patient restored the ability to grasp an item while the patient that was paralyzed below the knees was able to bend both ankles	27025
105	The suicide rate in rural America has increased more than 40% in 16 years. Overall, the suicide rate in rural areas is 40% higher than the national average and 83% higher than in large cities.	26971
106	Study reveals that climate change could dramatically alter fragile mountain habitats	26758
107	Sugar content is unacceptably high in children's fruit juices and smoothies	26742
108	The pancreas can be triggered to regenerate itself through a type of fasting diet, say US researchers. Restoring the function of the organ - which helps control blood sugar levels - reversed symptoms of diabetes in animal experiments.	26738
109	A 15-year study involving more than 3,000 adults found full-fat dairy can reduce your risk of developing diabetes by 46 per cent on average.	26640
110	Researchers find new phase of carbon, make diamond at room temperature	26534
111	Children who drink whole milk tend to be leaner and have higher vitamin D levels as those who drink low fat or skim milks, a Canadian study has found.	26523
112	Study: ‘Bad trips’ from magic mushrooms often result in an improved sense of personal well-being	26368
113	New blood test detects the human form of Mad Cow disease with 100% accuracy, a first for prion disease detection.	26311
114	A research team has shown that a lab-made molecule that mimics an antibody from our immune system may have more protective power than anything the body produces, keeping four monkeys free of HIV infection despite injection of large doses of the virus.	26298
115	"Don't study for exams by ""studying."" Instead, take practice tests, which help you remember better under stress, according to a new paper in Science"	26200
116	24 multiple sclerosis patients had their immune systems destroyed by chemo and then rebuilt using their own blood stem cells. Between 4 and 9 years later, 86% are still in remission and 91% show no signs of disease progression.	26105
117	Public Service Annoucement: /r/science is NOT doing any April Fool's Day jokes.	26093
118	Antidepressants taken during pregnancy increase risk of autism by 87 percent, new JAMA Pediatrics study finds	26082
119	Pets should be considered a main rather than a marginal source of support in the management of people diagnosed with a long-term mental health condition, finds University of Manchester researchers.	26022
120	Food Allergy transferred to patient following Bone Marrow Transplant.	25913
121	Ninety-five percent of women who have had abortions do not regret the decision to terminate their pregnancies, according to a study published last week in the multidisciplinary academic journal PLOS ONE.	25883
122	New opioid douses pain without being addictive or deadly in primates	25847
123	US suicide rate surges, particularly among white people	25662
124	Caffeine may counter age-related inflammation, possibly explaining why coffee drinkers tend to live longer than abstainers.	25530
125	"Anti-bullying program ""KiVa"" that focuses on teaching bystanders to intervene is one of the most effective in the world, reducing bullying by nearly twofold and improving mental health outcomes in the most severely bullied students"	25500
126	An estimated 4.5 billion cases of polio, measles, mumps, rubella, varicella, adenovirus, rabies, and hepatitis A were prevented and 10 million lives saved by the 1962 creation of the WI-38 human cell strain used in the production of vaccines	25471
127	After a search lasting 12 years, an international team of researchers has identified a biomarker that would allow Multiple Sclerosis (MS) subtypes to be determined with a simple blood test.	25446
128	A newly developed flow battery stores energy in organic molecules dissolved in neutral pH water. This new chemistry allows for a non-toxic, non-corrosive battery with a lifetime up to a decade and offers the potential to significantly decrease the costs of production.	25416
129	Stem cells from one monkey successfully regenerates the damaged heart of another monkey with no sign of immune system rejection, Nature study finds.	25396
130	Researchers have developed a blood test that can accurately diagnose, from a single drop of blood, if a person has cancer, with 96% certainty for most cancer types	25337
131	New species of feathered dinosaur from 66 million years ago found when workers in China used dynamite during school construction.	25298
132	Pornography users found to be more supportive of women and hold less sexist views than nonusers in representative US sample	25247
133	Gene therapy treats muscle-wasting disease in dogs: diseased dogs treated with a single infusion of the corrective therapy were indistinguishable from normal animals one year later.	25230
134	Scientists discover metal that conducts electricity but not heat, which breaks the Wiedemann-Franz Law, the rule that suggests good conductors of electricity will also be good conductors of thermal energy.	25160
135	Researchers have, for the first time, linked symptoms of difficulty understanding speech in noisy environments with evidence of cochlear synaptopathy, a condition known as “hidden hearing loss,” in college-age human subjects with normal hearing sensitivity.	24985
136	Caloric restriction increases lifespan in non-human primates. New study finds that food intake does influence longevity, with control monkeys nearly twice as likely to die as calorie restricted monkeys at any time point during the study.	24950
137	When drunk and surrounded by other drinkers, people’s judgements of their own levels of intoxication and the associated risks are related to the drunkenness of their peers, not on the objective amount of alcohol they have actually consumed, reveals a study by Cardiff University.	24948
138	Scientists remove HIV-1 from genome of human immune cells by using the CRISPR/Cas9 gene editing technique.	24905
139	Migraines are significantly reduced by a diet high in fat and low in carbs. The diet modulates the firing rates of neurons, a new study finds.	24893
140	Key ingredient in hallucinogenic ayahuasca brew stimulates the growth of human neural cells (in vitro) by 71.5% in four days.	24884
141	Stem Cells Regenerate Human Lens After Cataract Surgery, Restoring Vision	24849
142	Infants as young as six-months old grasp the complex interactions between a bully, a victim, and an intervening protector - and they root for the brave protector, researchers report this week in Nature Human Behaviour.	24741
143	People who report using seven to 11 social media platforms had more than three times the risk of depression and anxiety than their peers who use zero to two platforms, even after adjusting for the total time spent on social media overall.	24546
144	Dinosaur-Era Bird Wings Found in Amber	24540
145	Kids eat 54% more fruits and veggies if recess comes before school lunch	24479
146	Cougars can kill hundreds of deer over the course of their lives, leading some scientists to argue that restoring them to 19 states with large populations of deer could prevent automobile-deer collisions.	24430
147	In new study, HIV prevention pill Truvada is startlingly 100 percent effective	24383
