589	Natural antibodies could combat Tasmanian devil cancer as scientists may have found a way to stop the cancer that has been killing Tasmanian devils for the past 20 years.	11906
590	Scientists have uncovered a new species of duck-billed dinosaur, a 30-footlong herbivore that endured months of winter darkness and probably experienced snow. The skeletal remains were found in a remote part of Alaska. These dinosaurs were the northernmost dinosaurs known to have ever lived.	11896
591	Lack of exposure to natural light in the workspace is associated with physiological, sleep and depressive symptoms.	11876
592	A dinosaur mystery that has baffled palaeontologists for 50 years has finally been solved.	11851
593	Stem cells heal brain damage caused by radiation cancer treatment	11802
594	Canadian innovation for killing mosquito eggs could help Zika fight	11799
595	Time crystals - objects whose structure would repeat periodically, as with an ordinary crystal, but in time rather than in space - may exist after all.	11757
596	Huge gas cloud hurtling towards our galaxy could trigger the creation of 200 million new stars	11750
597	Critically endangered species successfully reproduced using frozen sperm from ferret dead for 20 years	11736
598	The Environmental Protection Agency has concluded that fracking can contaminate drinking water although the prevalence remains unknown	11656
599	Study shows that daughters of overweight fathers have higher breast cancer risk in mice. This suggests that miRNA may carry the epigenetic information from obese dads directly to their unborn daughters.	11637
600	Life 'not as we know it' possible on Saturn's moon Titan	11641
601	Researchers find flatworms that plunge their penises into their own heads to inject themselves with sperm	11636
602	World's oldest fishhooks, dating to ca. 21,000 BCE, found on Okinawa	11635
603	Women With More Male Friends Have More Sex Because Partners Fear ‘Sex Rivals’	11621
604	Cognitive therapy alone was the most effective treatment for social anxiety disorder, compared to medication alone or a combination of cognitive therapy and medication together, finds researchers based on a randomized clinical trial.	11622
605	A new study in infant gut microbiome supports the hygiene hypothesis: infants in the western countries have limited exposure to various microorganisms which has implications in the development of their immune system. This makes them prone to autoimmune diseases (e.g. type 1 diabetes) and allergies.	11591
606	Researchers have developed a new method for harvesting the energy carried by particles known as ‘dark’ spin-triplet excitons with close to 100% efficiency, clearing the way for hybrid solar cells which could far surpass current efficiency limits.	11591
607	Scientists say sudden oak death epidemic is no longer stoppable.	11565
608	"Study: Deep soil CO2 emissions far underestimated | ""by 2100 the warming of deeper soil layers could cause a release of carbon to the atmosphere at a rate that is significantly higher than today, perhaps even as high as 30% of today’s human-caused annual carbon emissions"""	11552
609	At least once a week, two thirds of all children of primary-school age will play an internet game that was created to draw attention to a brand. Most of these advertisements are for snacks and candy. Only 6% of these children are aware that they are ads, and the games do affect their behavior.	11551
610	Science AMA Series: We are living in Concordia station, Antarctica, researching glaciology, climate and physiology. We haven’t seen the Sun for 4 months and 4 months to go before fresh supplies are flown in. The temperature outside is –67.8°C. AMA!	11540
611	A drug-resistant form of Dysentery has begun to appear in the U.S. The highly contagious bacteria, Shigella, is resistant to Cipro and has caused outbreaks in several states this year, CDC reports.	11505
612	Analysis of one dinosaur reveals it lost teeth and grew a beak as it aged - Current Biology	11500
613	Patients don't understand risks of unnecessary antibiotics, study shows	11487
614	Five-dimensional black hole could ‘break’ general relativity	11466
615	Global warming pause never actually happened, NASA study confirms. The study, which examines two decades of observational data, offers the most definitive evidence to date that Earth’s largest ocean has been massively redistributing heat since 2003.	11469
616	Tooth decay in Calgary children has worsened since the city stopped fluoridating water in 2011	11457
617	Babies make copies of maternal immune cells they acquires through mother’s milk	11442
618	Brazilian wasp venom kills cancer cells by opening them up	11420
619	I’m Seth Shostak, and I direct the search for extraterrestrials at the SETI Institute in California. We’re trying to find evidence of intelligent life in space: aliens at least as clever as we are. AMA!	11405
620	Putting up fences around the world's largest living organism (the Aspen clone named Pando) is helping to extend its life	11364
621	For the first time ever, a patient's own skin cells were reverted to induced pluripotent stem cells, differentiated into retinal cells, and transplanted back into the patient as an experimental therapy for macular degeneration.	11357
622	"A team of scientists has, for the first time, discovered how to produce ultra-thin ""diamond nanothreads"" that promise extraordinary properties, including strength and stiffness greater than that of today's strongest nanotubes and polymer fibers."	11325
623	"Overfishing and shark-finning could increase the pace of climate change: ""removal of predators is likely to lead to a increase in ocean ecosystems’ CO2 production … typically, a predator population will only gain 10% of the biomass of the prey it consumes."""	11321
624	The simple statistic that perfectly captures what climate change means. From 1910 to 1960, the ratio of hot to cold records was close to 1 to 1. From 2000 to 2014, hot outnumbered cold records by more than 12 to 1.	11307
625	New HPV vaccine is effective against 9 strains of the virus	11286
626	Study shows that crows can perform as well as 7- to 10-year-olds on cause-and-effect water displacement tasks	11289
627	A new study suggests life in the city diminishes the fertility of birds. Researchers found that birds living in urban settings produce fewer and smaller offspring than birds in rural settings.	11282
628	Mosquitoes engineered to pass down genes that would wipe out their species	11276
629	Transcranial magnetic stimulation of the area of brain linked to reward conditioning appears to improve sexual responsiveness, which may offer a novel treatment for sexual desire problems, based on a study on men and women involving tasks, genital stimulation, EEG recordings and number of orgasms.	11276
630	In first, Japanese researchers observe chimp mother, sister caring for disabled infant: Born in January 2011 in a chimpanzee group in Tanzania, the female infant was “severely disabled,” exhibiting “symptoms resembling Down syndrome,” according to a summary of the team’s findings.	11229
631	A phantom road experiment reveals traffic noise is an invisible source of habitat degradation	11227
632	Wind Turbine Syndrome? Courts Aren’t Buying It. The report says the nocebo effect, in which a patient can be convinced that something benign is making them sick, could be responsible for many of the health complaints associated with wind turbines.	11168
633	HIV is evolving to become less deadly and less infectious, according to a new study that has found the virus’s ability to cause AIDS is weakening.	11164
634	Weight Lifting For Just 20 Minutes A Day Seems to Boost Memory, Benefiting Beginners, New Georgia Tech Study Shows	11152
635	Sea level in the Northeast and in some other US regions will rise significantly faster than the global average, according to a new report. In a worst-case scenario, global sea level could rise by about 8 feet by 2100. The report lays out 6 scenarios intended to inform national and regional planning.	11125
636	Researchers discover first sensor of Earth's magnetic field in an animal	11105
637	Over 50 days of monitoring, researchers found 2,625 different plant species for sale on eBay. 510 were known to be invasive in at least one region somewhere in the world. And out of that group, 35 are on the International Union for Conservation of Nature's list of the 100 worst invasive species.	11095
638	Decriminalising sex work would cut HIV infections by a third: Mathematical modelling work by researchers from Imperial College London estimates that decriminalising sex work could prevent up to 33 to 46 per cent of HIV infections among female sex workers and clients worldwide over the next decade.	11089
639	Sexual offending runs in families, 37-year nationwide study finds	11085
640	Brain scans show compulsive gamers have hyperconnected neural networks.	11051
641	Aging is associated with both a selective loss of fast-type skeletal muscle fibers and decreases in the robustness of the molecular clock. These new observations raise the possibility that fast to slow fiber-type shifts may be a result of dampening of the molecular clock with age.	11033
642	Functional artificial human liver grown in vitro from stem cells.	11002
643	The Middle East is undergoing “dramatic” atmospheric changes with plummeting levels of the pollutant nitrogen dioxide over the past five years. The bad news is that cleaner air has resulted from an industrial slowdown caused by political upheaval and armed conflict.	10992
644	Wearing a Suit Makes People Think Differently: Formalwear elicits feelings of power, which change some mental processes.	10952
645	The sleep-deprived brain can mistake friends for foes	10958
646	Magazines in waiting rooms are old because new ones disappear, not lack of supply.	10946
647	Lens turns smartphone into a microscope: Costs only 3 cents	10929
648	Discovery of fossilized soils on Mars adds to growing evidence that the planet may once have - and perhaps still does - harbor life	10925
649	Children being prescribed antibiotics at an alarming rate: over 11 million potentially needless prescriptions each year raises concerns about selecting for antibiotic resistance and perturbing the microbiome in young children	10899
650	Across three studies, researchers found that believers in psychic powers had memory abilities equal to skeptics, but they underperformed on tests of their analytical thinking skills.	10891
651	Climate change threat to public health worse than polio, White House warns | sweeping risks to public health from rising temperatures in the coming decades – with increased deaths and illnesses from heat stroke, respiratory failure and diseases such as West Nile virus	10895
652	A new nanomaterial that acts as both battery and supercapacitor has been developed by chemists. It could one day speed up the charging process of electric cars and help increase their driving range.	10874
653	Neurons in human skin perform advanced calculations, previously believed that only the brain could perform: Somewhat simplified, it means that our touch experiences are already processed by neurons in the skin before they reach the brain for further processing	10872
654	No evidence that children of same sex couples negatively impacted, study shows	10868
655	World's Oldest Broken Bone Pushes Back Our Transition to Land by Two Million Years	10859
656	Sleep restriction decreases morning resting metabolic rate in healthy adults, suggesting that sleep loss leads to metabolic changes aimed at conserving energy, new study finds.	10850
657	Parasite turns shrimp into voracious cannibals: Researchers found a tiny parasite, Pleistophora mulleri, not only significantly increased cannibalism among the indigenous shrimp Gammarus duebeni celticus but made infected shrimp more voracious, taking much less time to consume their victims.	10849
658	Researchers have found that adding graphene to Silly Putty results in a material that conducts electricity and is extremely sensitive to pressure. It could be used as a heart monitor or in other medical applications.	10813
659	Cancer therapy that engineers patient white blood cells to recognize and destroy tumors in their body posts impressive phase II result: 47% of patients experienced a complete remission, 5x better than current standard of care.	10790
660	Water Ice Found On Dwarf Planet Ceres, Hidden in Permanent Shadow	10762
661	The Recent /r/Science Shutdown.	10757
662	"MIT claims to have found a ""language universal"" that ties all languages together -- ""All languages, the authors say, self-organise in such a way that related concepts stay as close together as possible within a sentence, making it easier to piece together the overall meaning"""	10757
663	Octopus Found to Care For Her Eggs For 53 Months Without Leaving or Feeding, Then Dies	10751
664	A.I. Downs Expert Human Fighter Pilot In Dogfights: The A.I., dubbed ALPHA, uses a decision-making system called a genetic fuzzy tree, a subtype of fuzzy logic algorithms.	10752
665	Scientists discover that a protein in seminal fluid enables the mother's immune system to tolerate the fetus, this discovery is initiating the development of new treatments for recurrent miscarriage.	10746
666	Scientists have found that using cinnamon, a common food spice and flavoring material, can reverse the biomechanical, cellular and anatomical changes that occur in the brains of mice with Parkinson’s disease.	10725
667	Science AMA Series: I'm Christine Stawitz, a PhD candidate at the University of Washington, Seattle, I recently published a study that found up to 30 percent of seafood served in restaurants and sold in supermarkets is actually something else, AMA!	10722
668	Stress increases reward-seeking (i.e. wanting) but not reward enjoyment (i.e. liking). Chocolate-lovers who were stressed by putting their hands in ice water exerted 3x as much effort to be able to smell a chocolate odor than those who weren't stressed, but they didn't enjoy the experience any more.	10673
669	Sweetgrass, a traditional herbal remedy, was used by Native Americans as an insect repellent. So, chemists extracted essential oils from the plant and demonstrated that they were about as effective as DEET at keeping mosquitoes away.	10676
670	Taking 3 slow, short walks of 5 minutes each reverses harmful effects of prolonged sitting for 3 hours	10664
671	Ancient magma plumbing found buried below moon's largest dark spot	10630
672	Crops yields around the world could fall within a decade unless action is taken to speed up the introduction of new varieties. A study says temperatures are rising faster than the development of crop varieties that can cope with a warmer world.	10602
673	New HIV Treatment Aims To Starve Out the Virus Instead of Actively Kill It	10596
674	European honeybees are being poisoned with up to 57 different pesticides, according to new research. A new method for detecting a whole range of pesticides in bees could help unravel the mystery behind the widespread decline of honeybees in recent years, and help develop an approach to saving them.	10588
675	Half hour of physical activity 6 days a week linked to 40 percent lower risk of early death	10573
676	Study Finds 3 Laws Could Reduce Firearm Deaths by 90%	10568
677	Scientists create artifical neuron capable of mimicking function of human cells	10541
678	Fracking caused Ohio earthquake in 2014, say scientists	10535
679	Scientists achieve perfect efficiency for water-splitting half-reaction. The main application of splitting water into its components of oxygen and hydrogen is that the hydrogen can then be used to deliver energy to fuel cells for powering vehicles and electronic devices.	10519
680	In a series of studies, participants were more likely to imagine welfare recipients as being black, stereotyped them more negatively, and were less supportive of giving welfare to those same imagined recipients	10523
681	Cancer survivors more prone to obesity, study finds (risk appears to be particularly high for people who had breast or colon cancer)	10516
682	Community College and For-Profit College Graduates Earn Same Hiring Interest from Employers: Researchers found that hiring managers show no preference for hiring people with for-profit college credentials compared to those holding comparable credentials from public community colleges	10494
683	Fish diversity exploded when dinosaurs went extinct	10487
684	Drug Candidate Destroys Malaria in only 48 Hours	10476
685	An off-switch for obesity: An enzyme within the brain controls overeating.	10458
686	Most of America’s poor have jobs, study finds	10433
687	Scientists create hybrid supercapacitors that store large amounts of energy, recharge quickly and last for more than 10,000 recharge cycles.	10417
688	LSD impairs recognition of negative emotions but increases empathy and prosociality, study finds	10397
689	New research published today found that using marijuana as an adult is not associated with a variety of mood and anxiety disorders, including depression and bipolar disorder. This is a challenge to some previous research which has shown that marijuana use is associated with depression and anxiety.	10344
690	Analyzing DNA of nearly 2000 mothers of fraternal twins, researchers have found two genetic mutations which may increase the likelihood of twin births	10341
691	A gene mutation associated with colon cancer has been discovered in an 18th century Hungarian mummy. The finding suggests colon cancer's genetic roots predate modern risk factors.	10324
692	New research shows that cigarettes kill 2 out of 3 of its users, more than previously thought. Study looked at 205,000 people over 45 years	10297
693	‘Darwinian’ test uncovers an antidepressant’s hidden toxicity. Rodent study finds that exposure to an antidepressant in womb or in youth can cause lifetime decline in sexual behavior, body weight, and competitive ability.	10296
694	Biologist warn of early stages of Earth's sixth mass extinction event	10277
695	Science AMA Series: I'm Hugh Herr, professor and co-director of the Center for Extreme Bionics at the MIT Media Lab. At 17 I lost both my legs during a blizzard while rock climbing. Now I design bionic limbs that let us transcend disability and augment the human condition. AMA!	10248
696	Squid and octopus can camouflage themselves but new research finds they are colourblind	10242
697	Vision, not limbs, led fish onto land 385 million years ago - Researchers provide new hypothesis for the reason we walk the Earth	10229
698	An ANU team has successfully replicated one of the crucial steps in photosynthesis, opening the way for biological systems powered by sunlight which could manufacture hydrogen as a fuel.	10236
699	How weight loss surgery reverses Type 2 diabetes: gut bacteria changes, not weight loss, may be key in diabetes reversal in mice and humans	10230
700	Kids with ADHD must squirm to learn, study says	10227
701	Bee colonies in Brisbane are waging war for months on end, sending waves of workers who collide, grapple and die. A genetic analysis of the battlefield fatalities showed that two different species of stingless bees were fighting for control of a single hive.	10223
702	Spending time playing video games may be good for children. Researchers in Europe found elementary school-aged children who played video games had nearly twice the odds of high intellectual function and high overall school competence, though they caution against over-interpreting the study.	10212
703	Enzyme that 'stops sugar being stored as fat' is identified by scientists	10205
704	Brain of 25-year-old former football player found to have signs of chronic traumatic encephalopathy (CTE).	10165
705	Poverty linked to childhood depression, changes in brain connectivity	10145
706	Researchers have developed a new test that can detect nearly any virus known to infect humans and animals. The researchers are making the technology they developed publicly available to scientists and clinicians worldwide, for the benefit of patients and research.	10134
707	Mother of Higgs boson found in superconductors: A weird theoretical cousin of the Higgs boson, one that inspired the decades-long hunt for the elusive particle, has been properly observed for the first time. The discovery bookends one of the most exciting eras in modern physics.	10129
708	Megacities that are most threatened by climate change are doing the least about it, says new study: climate change adaptation in global megacities are protecting wealth – not people	10124
709	Action video games improve brain function more than so-called ‘brain games’	10114
710	"Steam from the sun: A new material structure developed at MIT generates steam by soaking up the sun. ""The new material is able to convert 85 percent of incoming solar energy into steam — a significant improvement over recent approaches to solar-powered steam generation."""	10124
711	Regular coffee consumption contributes to DNA integrity	10121
712	Anti-aging drug everolimus has been demonstrated to increase the lifespan of mice by 9-14%, even when the treatment was initiated later in life	10114
713	Scientists have sequenced the mitochondrial genome for the Hispaniolan solenodon, a venomous mammal found only on Hispaniola. Findings confirm that the the species diverged from all other living mammals 78 million years ago, long before an asteroid wiped out the dinosaurs.	10100
714	Researchers have created the first map that shows the global genetic interaction network of a cell. It begins to explain how thousands of genes coordinate with one another to orchestrate cellular life.	10087
715	Researchers have developed a method of producing hydrogen peroxide on demand through a simple, one-step process. It enables dilute H2O2 to be made directly from hydrogen and oxygen on-site, making it more accessible to underdeveloped regions of the world, where it could be used to purify water.	10089
716	Randomized, double-blind study shows the quality of sushi is not ruined by freezing, which also kills parasites	10072
717	Each time we learn something new, our brain cells break their DNA, creating damage that the neurons must immediately repair. This process also underlies age-related degeneration.	9975
718	Coffee consumption rapidly reduces background DNA strand breaks in healthy humans	9976
719	A disorder that causes the individual to fly off the handle unexpectedly, as in road rage, has been significantly linked with toxoplasmosis, a parasite commonly associated with cat feces, according to the Journal of Clinical Psychiatry.	9969
720	Regardless of the circumstances, women who prefer physically formidable and dominant mates also tend to feel more vulnerable to crime	9932
721	Birds slur their songs under the influence of alcohol.	9902
722	A CDC report showing a 30% rise in autism spectrum disorders over the span of a few years triggered widespread concern over one question: what was the cause? A new study suggests the answer may have less do with the actual number of autistic children and more with the nature of how we diagnose them.	9892
723	Up to 30% of all seafood sold in markets and served in restaurants may be mislabeled. A new study finds that in most cases, mislabeling actually leads people to eat more sustainably, because the substituted fish is often more plentiful and of a better conservation status than the fish on the label.	9902
724	New study shows that being in a position of power can fundamentally change the way you speak, altering basic acoustic properties of the voice, and other people are able to pick up on these vocal cues to know who is really in charge.	9895
725	Today CERN launched its Open Data Portal, which makes data from real collision events produced by LHC experiments available to the public for the first time.	9893
726	Student proves existence of plasma tubes floating above Earth	9877
727	World's first baby born from frozen ovary, collected during the mother's childhood	9875
728	Extra Brain Cells Make Males Remember Sex: A pair of neurons has been found in the brain of male nematode worms that allow them to remember and seek sex even at the expense of food	9864
729	LIGO makes gravitational wave announcement today	9862
730	Scientists have linked pupil size to perception of time in milliseconds in Japanese macaques. When the monkeys underestimated a second by looking too soon, their pupil sizes were slightly larger than in trials in which the monkeys overestimated a second.	9852
731	Global study shows that in the past 20 years a big change happened in risk factors for death and that the leading risk factors now are high blood pressure and poor diets	9845
732	By electrically stimulating a deep, middle brain structure, researchers have managed to block pain signals at the spinal cord level without drug intervention. The process also triggers the release of beneficial dopamine, which may reduce the emotional distress associated with long-term pain.	9813
733	Geologist uncovers 2.5 billion-year-old fossils of bacteria that predate the formation of oxygen	9790
734	"Drug-resistant malaria has been detected at the Myanmar-India border and now poses an ""enormous threat"" to global health, scientists have said."	9789
735	Pigeons Can Read A Little Bit, New Research Shows	9790
736	Scientists have successfully beamed power to a small camera by using ambient wi-fi signals	9779
737	Cat parasite Toxoplasma gondii linked to mental illness, schizophrenia	9770
738	On the reception and detection of pseudo-profound bullshit: New study has found that people who are more susceptible to bullshit score lower for verbal and fluid intelligence, are more prone to conspiratorial ideation, and more likely to endorse complementary and alternative medicine.	9757
