292	Scientists have found a bacteria that prevents mosquitoes from transmitting Zika and Chikungunya	18255
293	Very fit men in their late 40s are less likely to get lung cancer and colorectal cancer than unfit men. Their high fitness levels also appear to increase their chances of surviving cancer if they are diagnosed later on. Even small improvements in fitness could help to reduce cancer risk.	18180
294	NASA now says vast methane cloud over US southwest is for real	18167
295	Large Hadron Collider: Subatomic particles have been found that appear to defy the Standard Model of particle physics. The scientists working at CERN have found evidence of leptons decaying at different rates, which could be evidence for non-standard physics.	18139
296	Self-control saps memory resources: new research shows that exercising willpower impairs memory function by draining shared brain mechanisms and structures	18131
297	Over the last four decades, as much as 80 percent of all coral in the Caribbean has disappeared. Now, for the first time, coral raised in a lab has been successfully integrated into a wild population and reproduced on its own.	18114
298	A new study finds feeling like you're an expert can make you closed-minded	18101
299	Study says that no matter what we do to curb global warming, Miami, New Orleans, and other beloved US cities will sink below rising seas. But making extreme carbon cuts and moving to renewable energy could save millions of people living in iconic coastal areas of the United States, said the findings	18041
300	A team of psychologists have published a list of the 50 most incorrectly used terms in psychology (by both laymen and psychologists) in the journal Frontiers in Psychology. This free access paper explains many misunderstandings in modern psychology. [X-post from our sister sub /r/EverythingScience]	18028
301	Scientists say that the fresh, earthy smell after a rain is a chemical called geosmin. This byproduct of bacteria and fungi is launched into the air as raindrops hit the ground and can sometimes spread diseases.	18004
302	Elephant seals have helped scientists to demonstrate that fresh water from Antarctic's melting ice shelves slows the processes responsible for the formation of deep-water ocean currents that regulate global temperatures.	17993
303	CDC: 90% of kids who died last flu season didn't get vaccine	17980
304	Absent-mindedly talking to babies while doing housework has greater benefit than reading to them	17949
305	A majority of patients in the United States visited a doctor who received payments from drug companies, but most have no clue about it, according to a new Drexel University study.	17912
306	It is difficult to produce a permanent magnet with a magnetic field of a specific pre-determined shape. Researchers used a 3D printer to make such a magnet. This allows magnets to be produced in complex forms and precisely customized magnetic fields, required, for example, in magnetic sensors.	17914
307	80% of cancer patients reported significant decreases in anxiety & depression 6 months after a single session with the hallucinogen psilocybin, the active ingredient in magic mushrooms	17899
308	Speakers of futureless tongues (those that do not distinguish between the present and future tense, e.g. Estonian) show greater support for future-oriented policies, such as protecting the environment	17891
309	Apes may be capable of speech: Koko - an encultured gorilla best known for learning sign language - has now learned vocal and breathing behaviors reminiscent of speech	17876
310	In a study of 1,787 adults between 19 and 32, new study finds a significant relationship between depression and social media usage. Specifically, the more social media someone uses the more likely it is that they suffer from depression even after controlling for relevant covariates.	17860
311	Science AMA Series: We just published a study showing that ~97% of climate experts really do agree humans causing global warming. Ask Us Anything!	17837
312	"Scientists have developed a way to inject healthy human nerve cells into the brain: it involves converting adult tissue-derived stem cells into human neurons on 3-D ""scaffolds"" of fibers"	17832
313	Humans killed at least 2.8 million whales in the 20th century.	17810
314	We are slowly winning the war on cancer: Mortality rates have fallen from 215 deaths per 100,000 to 172 per 100,000.	17810
315	Mars has just exited an extreme ice age, according to new research. At its peak, 370,000 years ago, “Mars would have actually looked more white than red,” says the lead astrophysicist, Isaac Smith.	17709
316	NASA's peer-reviewed EM Drive paper has finally been published online as an open access 'article in advance' in the American Institute of Aeronautics and Astronautics (AIAA)’s Journal of Propulsion and Power, to appear in the December print edition.	17699
317	Pacific Ocean surface temperatures predict United States heat waves up to 50 days in advance	17700
318	For the first time, astronomers have detected the presence of complex organic molecules, the building blocks of life, in a protoplanetary disc surrounding a young star. The discovery reaffirms that the conditions that spawned the Earth and Sun are not unique in the Universe.	17685
319	Scientists have found “hidden” brain activity that can indicate if a vegetative patient is aware	17681
320	"A parasitic beetle is able to infiltrate ant colonies by mimicking the sounds that the queen makes, and is then able to move around the colony at will, preying on ants, and ""treated like royalty"", according to a new study."	17664
321	‘Fat but fit’ may be a myth, researchers say: the beneficial effect of high aerobic fitness appeared to be reduced with increased obesity. In fact, those at the most extreme in terms of obesity did not see a benefit at all from aerobic fitness.	17607
322	Whales Mourn Their Dead, Just Like Us	17592
323	The smart mouse with the half-human brain: When human brain cells called astrocytes are let loose in mouse brains, they rapidly overwhelm the mouse cells and make the rodents smarter	17582
324	Electronic cigarettes offer smokers a realistic way to kick their tobacco smoking addiction. In a new study scientists report that e-cigarettes successfully reduced cravings for tobacco cigarettes, with only minimal side effects.	17580
325	Man Dies After Tapeworm Inside Him Gets Cancer - This is the first known report of a person becoming sick from cancer cells that developed in a parasite.	17559
326	Science AMA Series: I'm Yaniv Erlich; my team used DNA as a hard-drive to store a full operating system, movie, computer virus, and a gift card. I am also the creator of DNA.Land. Soon, I'll be the Chief Science Officer of MyHeritage, one of the largest genetic genealogy companies. Ask me anything!	17555
327	Research has shown that the brain has a very strong racial bias in response to seeing others in pain or suffering. As a result, we have much stronger biologically-driven empathy towards people of our own race. However, the level of empathy increases the more a person spends time with other races.	17535
328	Nearly 80% of peanut-allergic preschool children successfully incorporated peanut-containing foods into their diets after receiving peanut oral immunotherapy (OIT), a clinical trial has found.	17518
329	For the first time, scientists have made tire-grade rubber without the processing step—vulcanization—that has been essential to inflatable tires since their invention. The resulting material heals itself and could potentially withstand the long-term pressures of driving.	17501
330	A species of cavefish has been documented walking and climbing waterfalls in a manner similar to four footed creatures, in a find researchers call “huge” in evolutionary terms. It has anatomical features previously known only in tetrapods, four-limbed vertebrates that include amphibians and reptiles	17460
331	Long-term relationships may reduce women's sex drive. New research examines the relation between female sexual functioning and changes in relationship status over time.	17321
332	Alzheimer's breakthrough: Scientists may have found potential cause of the disease in the behaviour of immune cells	17303
333	Scientists stumble over cheap material that can suck mercury out of oceans	17285
334	Hallucinatory 'voices' shaped by local culture. In the U.S.A., voices are harsh and threatening while those heard by schizophrenics in Africa and India tend to be more benign and playful.	17279
335	Scientists just discovered a weird new shark that glows in the dark, so they officially named it the 'ninja lanternshark'	17252
336	The night sky is vanishing: The Milky Way is hidden from more than one-third of humanity, including 60% of Europeans and nearly 80% of North Americans due to light pollution.	17249
337	The length of the average erect human penis is 13.12 cm (5.16 inches).	17235
338	"Scientists have built autonomous nanobots powered only by chemical energy that can ""sense"" their environment and repair broken circuits too small for a human eye to see."	17185
339	Fracking Chemicals Detected in Pennsylvania Drinking Water	17194
340	Scientists say they have found a direct link between fracking and earthquakes in Canada	17181
341	New study finds that not only does group discussion of politics polarize the views of participants, it leads to believing the views of others were more extreme than they were. These findings have implications for the awareness of psychological biases and societal effects of partisan discussion.	17109
342	Primal pull of a baby crying reaches across species: Mother deer rushed towards the infant distress calls of seals, humans and even bats, suggesting that these mammals share similar emotions	17083
343	Engineers have created the world's fastest stretchable, wearable integrated circuits, just 25 micrometers thick, that can be placed on to the skin like temporary tattoos and could lead to many advancements in wearable electronics	17019
344	Clean Power Could Actually Save US Billions Of Dollars Each Year	17014
345	Humans have evolved a disproportionately large brain as a result of sizing each other up in large cooperative social groups, researchers have proposed.	16995
346	Super-hard metal 'four times tougher than titanium'	16991
347	Calcium supplements may increase the risk of heart damage and plaque buildup in arteries, even though a diet high in calcium-rich food appears to help protect the heart, a study concludes.	16969
348	Researchers discover astonishing behavior of water confined in carbon nanotubes - water turns solid when it should boil.	16955
349	An Edible Vaccine For Wild Apes Could Revolutionize the Way We Fight Ebola	16835
350	Babies know when they don’t know something	16773
351	"Women have not always lived longer than men. The ""mortality gap"" is a recent phenomenon. Smoking and heart disease are responsible for most excess male deaths in the 20th century."	16767
352	Voting on Embryonic Stem Cell Research - Citizens More Supportive than Politicians (research paper)	16620
353	"A rare single-celled sea organism has components that resemble an eye, including a ""lens"", ""cornea"" and ""retina"". A new study indicates that each of the components were acquired embosymbiotically from different sources. The creature could answer some long-standing questions on the evolution of eyes."	16618
354	Legalizing ivory trade won't save elephants, study concludes	16585
355	When two ant colonies are fighting, the victorious ants' genetic makeup changes. Furthermore, in some cases, fatal fights with thousands of casualties do not produce a distinct winner. Instead, colonies cease fighting and fuse together, with the queen of each colony still alive.	16575
356	New study finds that DNA can survive a flight through space and re-entry into Earth's atmosphere and still pass on genetic information. These results indicate that life and organic molecules could potentially spread between planetary bodies through meteor impacts.	16543
357	A study conducted in Chicago found that giving disadvantaged, minority youths 8-week summer jobs reduced their violent crime rates compared to controls by 43% over a year after the program ended.	16546
358	By age 3, kids know when you owe them one.	16535
359	Brains of overweight people ‘ten years older’ than lean counterparts at middle-age	16521
360	Researchers have just developed an altogether new way to 3D print practically flawless ceramics—including fantastically heat-resistant varieties that've so far been beyond our reach.	16473
361	Scientists Warn of Perilous Climate Shift Within Decades, Not Centuries	16443
362	Molecular scientists unexpectedly produce new type of glass	16439
363	Global temperatures in 2015 by far hottest in modern times. Not only was 2015 the warmest year since records began, it shattered the previous record held in 2014 by the widest margin ever observed.	16429
364	Positive fantasies about the future linked to increased symptoms of depression	16392
365	New drug 'wakes up' immune system to fight one of deadliest cancers: IMM-101 drug has extended lives of people with metastatic pancreatic cancer and appears to have no side-effects	16372
366	The secret to a happy sex life in long-term relationships is the belief that it takes hard work and effort, instead of expecting sexual satisfaction to simply happen, says University of Toronto based on research with approximately 1,900 participants from both heterosexual and same-sex relationships.	16353
367	Google's artificial intelligence program has officially beaten a human professional Go player, marking the first time a computer has beaten a human professional in this game sans handicap.	16276
368	E-cigarettes emit harmful chemicals, research suggests: Researchers found as e-cigarettes get hotter the more toxic emissions they give off	16216
369	Study: For optimal heart health, Americans should double or even quadruple the amount of exercising they’re doing. The findings challenge the notion of a 30-minutes-a-day magic number for exercise.	16220
370	Two studies into zebra finches show they get a hit of dopamine when they hear a pitch-perfect song – and when learning, they listen to the spaces between notes.	16203
371	Phase II clinical trials of AIDS vaccine underway after successful phase I of clinical trials	16203
372	Ants have been farming longer than humans have, but as new research reveals, they still haven't domesticated their preferred crop -- fungus.	16200
373	97% of climate science papers support the consensus. What about those that don't? The one thing they seem to have in common is methodological flaws like cherry picking, curve fitting, ignoring inconvenient data, and disregarding known physics.	16200
374	6,000-year-old temple unearthed in Ukraine	16191
375	Astronomers have discovered that a star thought to be younger than the Sun is actually 12 billion years old.	16191
376	"9 in 10 scientists think climate change is real | 700 Non-climate scientists at Big Ten universities were surveyed 92% of scientists believe humans are to blame for global warming 94% of scientists ""strongly agree"" or ""moderately agree"" that climate science is credible"	16133
377	Scientists discovered that brain cells prefer one parent's genes over the other's which defies classic genetics and suggests new ways that genetic mutations might cause brain disorders	16108
378	Testing for malaria—or cancer—at home, via cheap paper strips; Chemist develops tech to save lives in rural Africa	16058
379	Water ice found on the surface of comet 67P	16013
380	Smoking high strength cannabis may damage nerve fibres in brain	16023
381	Men who see themselves as playboys or as having power over women are more likely to have psychological problems than men who conform less to traditionally masculine norms, according to research	15993
382	The Teen Brain “Shuts Down” When It Hears Mom’s Criticism	15986
383	"The surprising psychology of shoppers and return policies: ""One surprising finding: More leniency on time limits is associated with a reduction — not an increase — in returns."""	15962
384	Frequent viewing of “selfies” that have been posted on social media sites such as Facebook is linked to decreased self-esteem and life satisfaction, a study found.	15939
385	Peregrine Falcons, in their normal habitat on isolated cliffs, mate for life. Scientists investigated whether typical breeding patterns hold true for city-dwelling falcons due to the to the higher density of potential mates, and confirmed that even in the big city, the behavior is consistant	15882
386	Poverty Increases The Risk Of Unintended Pregnancy. Research shows that poor women of all races have fewer but longer relationships, use contraceptives less frequently, and use less effective methods than women from more advantaged backgrounds.	15869
387	This is the most detailed map yet of our place in the universe	15866
388	One of the oddest predictions of quantum theory,that a system can't change while you're watching it, has been confirmed in an experiment by physicists. Their work opens the door to a fundamentally new method to control and manipulate the quantum states of atoms and could lead to new kinds of sensors	15831
389	Parenthood is associated with a longer life than childlessness, particularly in older age, according to a new study. By the age of 60, the difference in life expectancy, which does not seem to be influenced by the sex of the child(ren), may be as much as two years.	15728
390	Discovery of genes involved in inner ear development hints at a way to restore hearing and balance	15700
391	Women are twice as likely to die from causes related to pregnancy or childbirth in the United States than in Canada, a new global survey of maternal mortality published by the United Nations and the World Bank showed	15655
392	Students suspended for marijuana 1.6 times more likely to use it again, compared to students kept in class and counseled: study	15658
393	Accepting a job below one’s skill level can adversely affect future employment prospects	15655
394	People who have survived traumas involving multiple injuries may have lower quality of life over 5 years post-trauma, suggesting that rehabilitation should address psychological after-effects as well as physical ones.	15641
395	Homeopathy not effective for treating any condition, Australian report finds | Life and style | The Guardian	15639
396	When a group of strangers is thrown together, individuals who score high on narcissism enjoy an early surge of admiration, recognition and friendship among their peers. But over time, their self-assurance and showmanship cease to build or sustain the growth of friendships.	15577
397	An anti-biotechnology activist group has targeted 40 scientists, including myself. I am Professor Kevin Folta from the University of Florida, here to talk about ties between scientists and industry. Ask Me Anything!	15550
398	Update: In a larger trial of 150 MS patients who received stem cell transplants, 80% were relapse-free after 4 years and more than half saw an improvement in physical disability after 2 years - a first for any MS treatment	15509
399	First Warm-Blooded Fish Identified	15426
400	Researchers find that a steady diet of corn is turning wild hamsters in northeastern France into deranged cannibals that devour their offspring	15423
401	North American forests expected to suffer, not benefit from climate change.	15416
402	Speed of glacier retreat worldwide 'historically unprecedented', says report. Researchers have recorded rapid rises in meltwater and alarming rates of glacial retreat, which are accelerating at a pace double that of a decade ago.	15420
403	Women instinctively guard their sexual partners from other women who are ovulating	15320
404	NASA confirms Voyager is the first Earth craft to travel into interstellar space	15327
405	"Happiness genes located for the first time - ""A huge study involving over 190 researchers in 140 research centers in 17 countries has located genetic variants associated with happiness and other traits. It is one of the largest studies ever published on genes involved in human behavior."""	15243
406	Man's kidney failure linked to his habit of drinking a gallon of iced tea each day.	15237
407	Study finds that when people don't like the political implications of the solution to a problem, they are more likely to deny the problem exists at all.	15231
408	99% of coral reefs to be impacted by climate change, study says	15203
409	The power of thank you: A key ingredient to improving couples' marriages might just be gratitude, according to new research	15192
410	Engineers use hedgehog-inspired biomimicry to craft better helmets. Findings show that in certain conditions, hedgehog spines can absorb as much, if not more, than industry standard impact-absorbing foam.	15181
411	Young children (aged 7-12) outperformed adults when producing creative ideas for smartphones. Ideas from children were more original, transformational, implementable, and relevant than those from the adults.	15131
412	A strange animal that lived on the ocean floor 500 million years ago has been assigned to the tree of life, solving a long-held mystery.	15098
413	Boys high in cognitive empathy attracted an average of 1.8 more girl friendships than low empathy counterparts, as revealed by a landmark study, “When Empathy Matters: The Role of Sex and Empathy in Close Friendships.”	15081
414	"Teen drug and alcohol use continues to fall, new federal data show: ""Teen marijuana use, a contentious topic now that several states have legalized marijuana sales, is also on the decline."""	15018
415	New study finds Seahorse Genome to be the most rapidly evolving fish genome studied so far.	15013
416	Sitting for long periods doesn’t make death more imminent, study suggests: In fact, sitting is no worse than standing for a person who doesn't otherwise move his or her body, the University of Exeter and University College London researchers found.	14972
417	Smoking and caffeine use are correlated primarily due to genetics, not environment or causality. The largest ever twin study of its kind combined with GWAS data and a separate longitudinal twin study indicates that genetic factors may make quitting smoking more difficult for heavy caffeine drinkers.	14939
418	Facebook use linked to depressive symptoms: spending lots of time on Facebook and comparing oneself to others tend to go hand in hand with depressed feelings	14922
419	Offshore wind farms create 'reef effect' perfect for marine wildlife - especially seals - “Things like barnacles and mussels will settle on hard structures and then that in turn will attract other marine species and it builds up over time.”	14907
420	Gut microbe found in people with eating disorders (bulimia, anorexia). Experiments show it produces a human hormone mimic that affects feeling of satisfaction, energy use, and mood. The severity of eating disorder symptoms is positively correlated with immune reaction to the mimic.	14890
421	"""The Ebola victim who is believed to have triggered the current outbreak - a two-year-old boy called Emile Ouamouno from Guinea - may have been infected by playing in a hollow tree housing a colony of bats, say scientists."""	14851
422	Scientists have discovered a winged dinosaur - an ancestor of the velociraptor - that they say was on the cusp of becoming a bird. The 6ft 6in (2m) creature was almost perfectly preserved in limestone, thanks to a volcanic eruption that had buried it in north-east China.	14844
423	Children’s intelligence mind-sets (i.e., their beliefs about whether intelligence is fixed or malleable) robustly influence their motivation and learning. New study finds that the parents' views on failure (and not intelligence) are important in cultivating a growth mindset.	14821
424	Experiments confirm that the barium-144 nucleus is pear shaped	14821
425	Newly discovered blue whirl fire tornado burns cleaner for reduced emissions	14769
426	Based on first-year results of a two-year study, researchers find helmetless-tackling drills is effective in reducing head impacts by 28 percent in one season. The innovative technique alters tackling behavior and is meant to reduce risk of head injury.	14758
427	Women Like Being Valued for Sex, as Long as it is by a Committed Partner.	14668
428	Vancouver researchers have created an enzyme that changes donated blood into universal type	14654
429	The genetic diversity of the English bulldog is so low that cross-breeding is recommended to reverse the various health issues associated with the breed, according to a new study.	14565
430	New species of highly venomous snake discovered in Australia	14567
431	Nearly every food or beverage endorsed by musicians who scored a hit in the Billboard Hot 100 Chart in the years 2013 and 2014 is unhealthy, the study found.	14561
432	"An analysis of a 9th century engraved silver ring from Sweden has revealed evidence of close contacts between Viking Age Scandinavians and the Islamic world. The ring is set with a piece of imported coloured glass that is inscribed with Arabic writing that reads ""For/To Allah""."	14501
433	Science AMA Series: We just published a paper showing recent ocean warming had been underestimated, and that NOAA (and not Congress) got this right. Ask Us Anything!	14508
434	New, Terminator-inspired 3D printing technique pulls whole objects from liquid resin by exposing it to beams of light and oxygen. It's 25 to 100 times faster than other methods of 3D printing without the defects of layer-by-layer fabrication.	14452
435	Traumatic stress changes the brains of boys and girls differently. A brain region that integrates emotions and actions appears to undergo accelerated maturation in adolescent girls with PTSD, but not in boys with the condition, a study has found.	14447
