403	Just 90 companies are to blame for most climate change, this 'carbon accountant' says	32348
404	Muslim woman prevented second terror attack on Paris by tipping off police about whereabouts of ISIS mastermind	32323
405	Muslim migrant boat captain who 'threw six Christians to their deaths from his vessel because of their religion' goes on trial for murder	32320
406	Over 1 million in Seoul protest to demand president’s resignation	32270
407	The family of the codebreaker Alan Turing will visit Downing Street on Monday to demand the government pardons 49,000 other men persecuted like him for their homosexuality.	32200
408	Parents who let diabetic son starve to death found guilty of first-degree murder: Emil and Rodica Radita isolated and neglected their son Alexandru for years before his eventual death — at which point he was said to be so emaciated that he appeared mummified, court hears	32193
409	Lego ends advertising with Daily Mail after calls for companies to 'Stop Funding Hate'	32123
410	The South Korean President has been under the control of a Shadow Cabal of 8 oligarchs	32125
411	A Dutch woman who alleged she was raped after being drugged in an upscale nightclub in Doha was convicted of having sex out of wedlock by a Qatari court on Monday and given a one-year suspended sentence.	32100
412	Fethullah Gülen: Turkey coup may have been 'staged' by Erdogan regime	32032
413	Rio 2016: Olympic athletes told to ‘keep your mouth closed’ when in contaminated water	31860
414	Cuba Allows Google to Install Servers and Provide faster Internet Access	31844
415	'They rape us. We kill them': Yazidi singer forms all-female fighting unit to take revenge on ISIS for forcing their sisters into sexual slavery and beheading their brothers	31809
416	Missile which shot down flight MH17 over Ukraine in 2014 was brought in from Russian territory - investigators	31775
417	Medical cannibis will be legalised nation-wide across Australia in November	31757
418	WikiLeaks claims first batch of stolen CIA documents 'less than 1%' of total release	31737
419	Russia seeks to declare Jehovah's Witnesses an extremist group	31707
420	"US President-elect Donald Trump has spoken directly with the president of Taiwan - breaking with US policy set in 1979 when formal relations were cut. Washington cut formal diplomatic ties with Taiwan in 1979, expressing its support for Beijing's ""One China"" policy."	31700
421	Cannabis ingredient to be classed as medicine in UK.	31612
422	Canadians want Trudeau to stand up to Trump, even if it leads to trade war: poll	31587
423	New Alzheimer’s treatment fully restores memory function - Australian researchers have come up with a non-invasive ultrasound technology that clears the brain of neurotoxic amyloid plaques	31581
424	"France will not ban Wi-Fi or Tor, prime minister says: ""Internet is a freedom, is an extraordinary means of communication between people, it is a benefit to the economy,"" Valls added"	31505
425	CEOs Can Now Be Prosecuted Like War Criminals at the Hague	31506
426	Reddit deletes surveillance 'warrant canary' in transparency report	31496
427	"Canada moving ahead with plans to ditch first-past-the-post electoral system. ""FPTP suited for fledgling democracies, mature democracies can do better,"" says minister in charge of reform."	31492
428	Russian opposition politician and former deputy PM Boris Nemtsov shot dead on Moscow street	31434
429	The Netherlands to decriminalize insulting heads of state	31412
430	Report: Obama quietly sent $221 million to the Palestinian Authority hours before leaving office	31394
431	Sweden announces first centre for raped men	31341
432	Navy halts live fire explosive exercises off Vancouver Island after being alerted to a pod of Orcas, including 3 calves, in vicinity; praised for being responsive	31335
433	Polish Olympian sells Rio medal to save three-year-old battling cancer	31239
434	First female Afghan air force pilot asks US for asylum -- Capt. Rahmani said it's no longer safe for her to live in Afghanistan. Her attorney, Kimberly Motley, said her client has received numerous threats from insurgents and condemnation from government officials	31221
435	Turkey to temporarily suspend European Convention on Human Rights after coup attempt	31203
436	Tesco to give all unsold food to charity after finalising deal - Supermarket giant says it aims to eradicate all food waste at its stores and distribution centres by 2017 (Tesco are the world's 2nd largest retailer and the largest in Europe)	31195
437	Alberta passes bill banning corporate and union donations to political parties	31195
438	A Brazilian Supreme Court justice called on Friday for the legalization of marijuana and even cocaine to undo the growing power of drug gangs behind a wave of violence that has shaken Latin America's largest country.	31183
439	WSJ: Trump's top national security adviser is being investigated for his communications with Russia	31175
440	Scotland just produced enough wind energy to power it for an entire day: Strong winds combined with low demand on a sunny summer Sunday help Scotland reach ‘significant milestone’ on path towards ditching fossil fuels entirely	31173
441	"Alcohol is a direct cause of seven ​​forms of cancer, finds study: ""...the epidemiological evidence can support the judgment that alcohol causes cancer of the oropharynx, larynx, oesophagus, liver, colon, rectum and breast.”"	31145
442	Russians who practice female genital mutilation (FGM) could face ten years imprisonment under a new bill. The bill says that FGM “has no place in a civilized society,” and was presented to parliament by United Russia deputy Maria Maksakova-Igenbergs.	31120
443	Ban On Tuna Labeled Dolphin-Safe Shows How TPP Will Crush Consumer Rights: ... dolphin-safe labeling of tuna managed to reduce annual deaths of the mammals from over 100,000 to only 3,000 but the World Trade Organization just effectively nullified this critical program	31093
444	Russia offers water bombers and specialists to help fight Fort McMurray forest fires	31077
445	Russian state television accidentally broadcasts evidence that Moscow uses cluster bombs in Syria	31019
446	The star witness in a case pitting rainforest villagers against a multinational oil giant has admitted to lying under oath in an effort to help Chevron avoid paying a $9.5 billion judgment for deliberate pollution of the Ecuadorian Amazon	31007
447	Good News. Tiger Numbers in India up From 1,400 to 2,226 in 7 Years	30985
448	Prince Charles warns horrific lessons of WW2 are in danger of being forgotten	30878
449	They sweat together, they sleep together: in the name of gender equality, Norway has introduced compulsory military service for women, even bunking them in mixed dorms with their brothers-in-arms. Almost a third of the Norwegian army conscripts born in 1997 were women this summer.	30806
450	Russian city sees domestic violence incidents double after Putin decriminalises beatings	30786
451	Kim Jong-nam killed by chemical weapon, say Malaysian police - Investigators identify substance used to murder Kim Jong-un’s half-brother as VX nerve agent, decribed as a weapon of mass destruction by the UN	30746
452	China on Tuesday rejected a plan by U.S. Republican presidential candidate Donald Trump to back out of a global climate change pact, saying a wise political leader should make policy in line with global trends, a rare comment on a foreign election	30732
453	Smoking gun emails reveal Blair's 'deal in blood' with George Bush over Iraq war was forged a year before the invasion had even started - despite claiming he wanted peace. Leaked White House memo shows former Prime Minister's support for war at summit with U.S. President in 2002.	30720
454	Declassified memo shows multiple Saudi connections to 9/11 plotters: flight certificate of Al Qaeda operative found in envelope from the Saudi Embassy in DC	30676
455	Syrian migrant helps capture ISIS terrorist who tortured him in his home country after spotting the Islamist in Germany	30670
456	"North Korea said it will launch a nuclear strike ""if a single bullet is fired"""	30688
457	Saudi man sentenced 10 years jail and weekly public canings for 5 months. He is guilty of setting up a public online forum for debate and discussion.	30652
458	'Shots fired' at French magazine HQ	30574
459	"Anti-gay US pastor legally banned from South Africa for being ""a member of or adherent to an association or organisation advocating the practice of racial hatred or social violence."""	30545
460	Cuba has pardoned 787 prisoners in response to Pope Francis's call for world leaders to show mercy to inmates, authorities said on Tuesday.	30495
461	North Korea begs for aid after floods despite spending millions on nukes	30439
462	Stabbings in Sagamihara, Japan: 19 dead	30427
463	North Korea demands Malaysia stop investigating Kim Jong-nam death	30372
464	Efficiency up, turnover down: Sweden experiments with six-hour working day | World news | The Guardian	30361
465	US 'got it so wrong' on Saddam Hussein, says CIA analyst who interrogated dictator | 'We never thought about using weapons of mass destruction,' former Iraqi ruler told CIA	30362
466	U.S. Allies Also Intercept Russia-Trump Adviser Communications	30352
467	Hong Kong students storm government HQ to demand full democracy	30335
468	Justin Trudeau: 'Globalisation isn't working for ordinary people'	30290
469	Samsung's billionaire chief is now in a jail cell with a mattress on the floor and no shower	30275
470	Kyrgyzstan president: 'Women in mini skirts don't become suicide bombers'	30181
471	A seven-year-old boy who went missing in bear-inhabited forests in northern Japan after his parents said they abandoned him as punishment, has been found alive, according to local reports.	30182
472	Apple recovered 2,204 pounds of gold from broken iPhones last year	30158
473	Canada just made it legal for police to search your cellphone without a warrant upon arrest.	30155
474	Seattle judge grants nationwide temporary restraining order on Trump immigration ban	30132
475	Fake US Embassy discovered to have been operating in Ghana for the past decade.	30119
476	Pakistan Is Arresting People Who Refuse to Vaccinate Their Kids Against Polio	30089
477	Apple wants the FBI to reveal how it hacked the San Bernardino killer's iPhone	30097
478	Rio Olympics could spark 'full blown global health disaster', say Harvard scientists	30086
479	No one wants to help Donald Trump build a registry of Muslims: Tech giants Microsoft and IBM have said they would refuse to help create a registry of Muslim Americans under Trump's presidency	30073
480	Two California Tourists Arrested For Engraving Their Names In Rome's Colosseum And Taking A Selfie	30038
481	iTunes is illegal under UK copyright law - The Intellectual Property Office today explains that ripping a CD in iTunes is no longer permitted, and neither is backing up your computer if it contains copyrighted content.	30030
482	Antarctica reaches 63F, highest temperature ever recorded.	30024
483	Native tribes from the U.S. and Canada signed a treaty Tuesday establishing an inter-tribal alliance to restore bison to areas of the Rocky Mountains and Great Plains where millions of the animals once roamed.	29949
484	Man Dies After Tapeworm Inside Him Gets Cancer - This is the first known report of a person becoming sick from cancer cells that developed in a parasite.	29923
485	Nike becomes suspected player in alleged $150 million FIFA bribery scandal	29882
486	Ireland plans to decriminalise the possession of small amounts of drugs, including heroin, cocaine and cannabis	29827
487	Mexico threatens trade war over Trump wall tax	29802
488	Russia Arrests Scientologist for Stealing $2 Million and Giving to Church	29788
489	Hundreds of thousands protest for fifth straight week against South Korean President	29722
490	India has slashed prices of 54 essential medicines by up to 55%, including commonly used drugs for cancer, hypertension, diabetes and other heart disorders.	29712
491	President Duterte threatens to burn down the UN HQ in NYC	29668
492	'Huge wake up call': Third of central, northern Great Barrier Reef corals dead, scientists say	29660
493	Google’s quantum computer just accurately simulated a molecule for the first time	29608
494	Nasa and Stephen Hawking are working on a nano-starship that can travel 1/5th the speed of light: 'If successful, the ship, called “StarChip” could reach Earth’s closest star system, Alpha Centauri, in 20 years.'	29580
495	India plans to spend $6 billion on creating new forests	29554
496	Philae comet lander wakes up [After 7 months]	29516
497	Man without arms denied housing loan due to inability to provide fingerprints	29516
498	Musk, Wozniak and Hawking urge ban on AI and autonomous weapons: Over 1,000 high-profile artificial intelligence experts and leading researchers have signed an open letter warning of a “military artificial intelligence arms race” and calling for a ban on “offensive autonomous weapons”.	29406
499	Saudi Ties to 9/11 Detailed in Documents Suppressed Since 2002	29383
500	NASA reveals that Antarctica is actually gaining more ice than it is losing	29349
501	"Scientists categorize Earth as a 'toxic planet': ""Earth, and all life on it, are being saturated with man-made chemicals in an event unlike anything in the planet's entire history."""	29316
502	2,500 Scientists To Australia: If You Want To Save The Great Barrier Reef, Stop Supporting Coal	29276
503	Coca-Cola calls for FIFA President Sepp Blatter to step down immediately.	29273
504	Malcom Turnbull becomes Prime Minister of Australia after Tony Abbott rejected by Liberal party	29217
505	Nigeria purges 50,000 ‘ghost workers’ from State payroll in corruption sweep	29203
506	"Brazil declares emergency after 2,400 babies are born with brain damage, possibly due to mosquito-borne virus ""This is an unprecedented situation, unprecedented in world scientific research,"" Brazil's health ministry said in a statement on its website"	29163
507	A decade on, vaccine has halved cervical cancer rate.	29149
508	First Polish patient wakes from coma due to brain stimulator implant	29148
509	Anger after Saudi Arabia 'chosen to head key UN human rights panel'	29128
510	Iceland is digging world’s deepest geothermal borehole into the heart of a volcano at a depth of 3.10 miles (5 km) to tap renewable energy. The extreme pressure and heat at such depths could derive 30 to 50 MW of electricity from one geothermal well.	29128
511	Hundreds of Kenyan girls are preparing to spend Christmas in schools, rather than with their families, fearing that their parents will force them to undergo female genital mutilation (FGM)	29128
512	Israel Ground Invasion of Gaza has Begun	29100
513	3 years later, Indian girl raped again by same five accused. No arrests made.	29063
514	Germany agreed Thursday to turn more than 60 former military bases into nature preserves, with the aim of creating vast new green oases and sanctuaries for rare species of birds	29059
515	"By 285 votes to 281, MEPs decide to call on EU member states to ""drop any criminal charges against Edward Snowden"""	29031
516	EU plan to give free Interrail pass to every 18-year-old in Europe on their birthday: 'The mobility of young people is essential in promoting a sense of belonging to Europe'	29027
517	A group of US Marines foiled a potential terror attack on a French train	29008
518	World wildlife 'falls by 58% in 40 years'	29000
519	Paris attacks ringleader dead - French officials	28984
520	Danish couple face 10 years in prison for selling cannabis to cancer patients	28973
521	"Top secret ""28 pages"" may hold clues about Saudi support for 9/11 hijackers"	28969
522	Ukraine Prime Minister Arseniy Yatsenyuk has just resigned	28962
523	Nestlé​ admits slavery and coercion used in catching its seafood	28890
524	Paris mayor: We intend to sue Fox News	28890
525	Denmark to stop paying salary to royal family grandchildren: 'Simple mathematics dictate that there needs to be some sort of limit. Otherwise within a few generations there will be several hundred princes and princesses who need an annual salary,' says a ruling party spokesman	28863
526	Thailand has shut down 10 popular diving sites in a bid to slow a coral bleaching crisis, an official said Thursday, in a rare move to shun tourism profits to protect the environment	28856
527	Philippines leader likens himself to Hitler, wants to kill millions of drug users	28817
528	"Bolivia declares Israel a ""terrorist state"" and bans its citizens from entering the country without a visa"	28735
529	Putin 'sought to help' Trump in US vote	28702
530	Fuel has gotten so cheap that ships are now choosing to take the long way around Africa rather then pay the fees to transit the Suez Canal.	28707
531	Thousands of prehistoric mammoth tusks are being dug out of the melting permafrost of the Arctic. They are then shipped to China for the ivory-carving industry, causing some scientists to question whether this perfectly legal trade should be banned.	28693
532	China has just banned the burqa in its biggest Muslim city	28689
533	All Turkish academics banned from traveling abroad – report	28655
534	Medical marijuana legal in all forms, Supreme Court rules (Canada)	28619
535	Justin Bieber impersonator charged with 900 child sex offenses	28608
536	Pope says evolution doesn't mean there's no God; In an address to the Pontifical Academy of Sciences, the Pope explains that God is not some sort of wizard.	28549
537	More than 28,000 people have disappeared in Mexico in the decade since the country began its war on drugs	28547
538	Berlin market attack suspect killed in Milan, reports say	28544
539	Zuckerberg, wife pledge to donate 99% of their Facebook shares, about $45 billion, to charity	28504
540	What the Internet hates about the TPP trade deal: After years of warning that the secretive TPP would be devastating for Internet freedom, intellectual property experts have finally gotten to look at the final draft of the proposed treaty. And they say it’s as bad as they feared	28474
541	Anonymous released 9,200 ISIS supporter Twitter account names to apply pressure on Twitter for suspending them	28438
542	Firms such as Kellogg's, Unilever and Nestlé 'use child-labour palm oil'	28395
543	Scientists Find A “Weak Spot” In HIV That May Pave the Way to a Vaccine	28383
544	Saudi man who called for end to 'guardianship of women' is jailed	28303
545	Get caught driving while on your mobile phone twice and lose your driving license in the UK	28292
546	Canada to introduce pot legalization legislation in 2017	28298
547	Mysterious Wooden Idol Found in Russia is 11,000 years old, The Shigir Idol is twice as old as the Pyramids and Stonehenge - and is by far the oldest wooden structure in the world. Covered in a code no one can decipher.	28280
548	The United Arab Emirates is going to start taking in Syrian refugees	28250
549	Fifty four large investors managing 1 trillion pounds ($1.41 trillion) in assets have launched a campaign to curb the use of antibiotics in the meat and poultry.	28174
550	US State Dept declares ISIS is committing genocide in Iraq, Syria	28160
551	‘This is not a Christian gesture’: Pope Francis denounces walls while praising immigrants	28161
552	U.S. Kills Leader of ISIS in Libya	28135
553	Many foreign tourists say they're afraid to visit the US after Trump travel ban	28134
554	Israel passes law to cap bankers' salaries: Israel has introduced one of the world’s toughest curbs on bank executives’ salaries in an effort to narrow a big pay gap between bosses and workers. It was approved in parliament overnight in a 56-0 vote and will take effect in six months.	28132
555	England's Doctors Walk Out of Emergency Wards in First Ever All-Out Strike	28113
556	Saudi Arabia just promised to sue anyone who compares their justice system to Isis	28116
557	101 year old man pulled out of rubble alive one week after Nepal earthquake.	28079
558	Zika crisis: Rio Olympics 'should be moved or postponed'	28073
559	Turkey just banned 50,000 from leaving the country	28066
560	Saudi man gets 10 years, 2,000 lashes over atheist tweets	28041
561	Exxon Knew about Climate Change Almost 40 Years Ago - A new investigation shows the oil company understood the science before it became a public issue and spent millions to promote misinformation.	28042
562	Lots of corpse flowers bloomed in 2016 and nobody knows why: The corpse flower takes ten years to build up enough energy to bloom, but mysteriously, dozens of them bloomed within weeks of each other in 2016	27972
563	U.S. drug company sues Canada for trying to lower cost of $700K-a-year drug.	27892
564	ISIS, Taliban announced Jihad against each other - Khaama Press (KP)	27897
565	Nestlé admits slavery in Thailand while fighting child labour lawsuit in Ivory Coast	27885
566	64 ISIS Members Killed As Egypt Launches First Foreign Strikes In 24 Years	27875
567	Military experts warn of 'epic' humanitarian crisis sparked by climate change	27875
568	2015 was the first year since 1974 in which no climber successfully made it to the top of Mount Everest.	27828
569	Obama Removes Cuba From State Sponsor of Terror List	27811
570	Nigerian man facing execution in Indonesia told court police electrocuted his genitals to force him to confess to possessing heroin...among several prisoners on death row...claims they were tortured and their legal cases riddled with corruption, errors and miscarriages of justice.	27732
571	Edward Snowden’s David Cameron Tweet Tells Public to Rise Up and Force PM’s Resignation	27736
572	Colombia has fired more than 1000 police officers in a massive crackdown on corruption	27729
573	A New Zealand man and his six-year old daughter missing at sea for more than a month have landed in Australia after sailing their small, damaged yacht across the treacherous 2,000 km (1,241.7 miles) Tasman Sea.	27718
574	Kim Jong Un Orders Military To Kill South Korean Leaders	27685
575	Russia has listed transsexual and transgender people among those who will no longer qualify for driving licences.	27660
576	Panama Papers include dozens of Americans tied to financial frauds	27629
577	France’s Prime Minister has backed the banning of burkini swimsuits, saying they are not compatible with French values and are based on the “enslavement of women”.	27624
578	The World Health Organization calls for the decriminalization of drug use	27604
579	A 1,000-foot-thick ice block about the size of Delaware is snapping off of Antarctica	27577
580	Scientists warn of coming global disaster because of water inequality.“We are revealing a global disaster in the making, yet we are seeing very little coordinated response.”	27572
581	Chinese paper calls Trump ‘as ignorant as a child’	27543
582	European robot probe Philae has made the first, historic landing on a comet, after descending from its mothership	27541
583	Mexican Officials Pass Proposal To Ban Donald Trump From Their Country	27532
584	Large quake detected in North Korea - BBC News	27520
585	Netherlands opens war crimes investigation into MH17 airliner downing	27476
586	Edward Snowden says it would be “crazy to dismiss” the prospect of Trump striking a deal with Putin that leads to his extradition and trial, but added: “If I was worried about safety, if the security and the future of myself was all that I cared about, I would still be in Hawaii.”	27478
587	Anonymous declares war on ISIS	27469
588	Hungary internet tax cancelled after mass protests	27399
589	Illegal Logging Is Depleting the Amazon Rainforest 29% Faster Than Last Year	27377
590	Afghan military interpreter who served with British forces in Afghanistan and was denied refuge in Britain has been executed	27357
591	"Scientists are about to switch on a telescope that could photograph a black hole's event horizon - ""the resolution of the telescope should be 50 microarcseconds. To put that into perspective, it's the equivalent of being able to see a grapefruit on the surface of the Moon"""	27344
592	1,500 acid attacks have been recorded in London since 2011	27333
593	Trump unaware that Michael Flynn was a 'foreign agent', Sean Spicer says. Flynn disclosed 2 days ago that he'd been lobbying for Inovo, a Danish firm linked to the Turkish president, Recep Tayyip Erdoğan	27326
594	Brits urged not to report Dubai crimes after 'gang-raped' woman arrested for extra-marital sex	27321
595	"And just like that, China becomes the world's largest solar power producer - ""(China) will be pouring some $364 billion into renewable power generation by the end of the decade."""	27312
596	The president and CEO of The Associated Press has called for changes to international laws that would make it a war crime to kill journalists or take them hostage	27306
597	"Hedge fund trader Martin Shkreli who raised the price HIV drug by 5,000% asked how he sleeps at night. His reply ""You know, Ambien"""	27276
598	A staggering 87 percent of Venezuelans say they do not have money to buy enough food	27270
599	ISIS beheads 81-year-old pioneer archaeologist and foremost scholar on ancient Syria. Held captive for 1 month, he refused to tell ISIS the location of the treasures of Palmyra unto death.	27268
600	Airliner crashes in French Alps	27256
601	No one has seen Kim Jon Un's wife for seven months	27223
602	Man Ejected From Somali Plane in Midair Was Suicide Bomber	27222
603	Scottish Government: creationism banned from science class	27211
604	"BBC staff ordered to stop giving equal air time to climate deniers: The network will stop airing ""debates"" featuring members of the anti-science fringe"	27192
605	September 2016 was the hottest on record, making it 11th of the last 12 months to hold that record, says Nasa	27191
606	Israel Proves the Desalination Era is Here - One of the driest countries on earth now makes more freshwater than it needs	27172
