0	"2.6 terabyte leak of Panamanian shell company data reveals ""how a global industry led by major banks, legal firms, and asset management companies secretly manages the estates of politicians, Fifa officials, fraudsters and drug smugglers, celebrities and professional athletes."""	154759
1	A biotech startup has managed to 3-D print fake rhino horns that carry the same genetic fingerprint as the actual horn. The company plans to flood Chinese rhino horn market at one-eighth of the price of the original, undercutting the price poachers can get and forcing them out eventually.	106040
2	'Shootings' reported in central Paris: Reports of shooting and casualties in central Paris	96991
3	Fidel Castro is dead at 90.	95051
4	Former French President Nicolas Sarkozy has proposed that Europe should impose a carbon tax on American imports if Donald Trump pulls the United States out of the Paris climate pact.	93490
5	US appeals court upholds suspension of Trump travel ban	88813
6	NASA announces discovery of flowing water in Mars	86746
7	Scientists slam Donald Trump's environment chief over climate denial: 'It's like disputing gravity'	84267
8	Costa Rica completes 2016 without having to burn a single fossil fuel for more than 250 days. 98.2% of Costa Rica's electricity came from renewable sources in 2016.	83255
9	President Donald Trump signed an executive order formally withdrawing the United States from the 12-nation Trans-Pacific Partnership trade deal	82147
10	North Korea bans sarcasm because Kim Jong-un fears people only agree with him ‘ironically’	81643
11	The Prime Minister of Iceland has resigned	80777
12	Japan firm considers 3-day weekends as nation rethinks culture of long work hours	80195
13	Australians petition to put Steve Irwin on their money.	80186
14	"""It’s time to pay a living wage, to pay your taxes, and to give your workers the benefits – and peace of mind – that come with stable, full-time contracts."" Canada's PM Trudeau blames corporate elites for rise in global public anger, points to record profits but overworked and underpaid workers."	77735
15	Twitter has forced 30 websites that archive politician's deleted tweets to shut down, removing an effective tool to keep politicians honest	77475
16	Canada's immigration website keeps crashing for 'some reason'	76378
17	President of South Korea Impeached.	76280
18	Putin says Russia ready to fully restore ties with U.S	75832
19	China bans all coal imports from North Korea, severing major financial lifeline for regime	75118
20	Hundreds of thousands of leaked emails reveal massively widespread corruption in global oil industry	74985
21	Trumps Immigration Ban Halted By Federal Court	73820
22	Iceland does what the US won’t: 26 top bankers sent to prison for role in financial crisis	73205
23	DNA Test Shows Subway’s Oven-Roasted Chicken Is Only 50 Percent Chicken	72256
24	Google will soon ban fake news sites from using its ad network - Cutting off their revenue streams	71617
25	"Feeding cows seaweed could slash global greenhouse gas emissions, researchers say: ""They discovered adding a small amount of dried seaweed to a cow's diet can reduce the amount of methane a cow produces by up to 99 per cent."""	71384
26	Fox New's fake expert on violent immigrants in Sweden turns out to be a violent Swedish immigrant in the US, Swedish media reports.	71356
27	State Dept reverses visa ban, allows travelers with visas into U.S. - official	70401
28	With only days until Donald Trump takes office, the Obama announced new rules that will let the NSA share vast amounts of private data gathered without warrant, court orders or congressional authorization with 16 other agencies, including the FBI, DEA and DHS.	69595
29	Iran will ban Americans from entering the country in response to Trump’s “insulting” order restricting arrivals from Iran and six other Muslim states	69469
30	Mexican president says he will not go to U.S. for meeting with Trump	69450
31	Up to 20 countries have indicated support for the Netherlands’ plan to set up an international safe abortion fund to plug a $600m funding gap caused by Donald Trump’s reinstatement of the “global gag rule”, the Dutch international development minister, Lilianne Ploumen, said on Wednesday.	67807
32	World of chess in uproar after women told they must play at next year’s world championships in Iran wearing hijabs	67048
33	“I will NOT wear a hijab and support women’s oppression”: US chess champion boycotts world championship in Iran	66905
34	Costa Rica has been running on 100% renewable energy for 2 months straight: 76 days and zero fossil fuels.	66799
35	Rio 2016: Swimmers need to ingest only three teaspoons of water to be almost certain of contracting a virus | Olympics | Sport	66513
36	Russia considers banning sale of cigarettes to anyone born after 2015	66410
37	ISIS Twitter accounts have been hijacked with gay porn	66160
38	Russia Bans Scientology	65940
39	Five HIV patients left 'virus-free' with no need for daily drugs in early vaccine trials	65783
40	Trump's Second Travel Ban Blocked by U.S. Judge	65651
41	Gravitational waves from black holes detected	65400
42	Donald Trump lifts sanctions on Russia that were imposed by Obama in response to cyber-security concerns	65361
43	Sweden asks the U.S. to explain Trump comment on Sweden	64758
44	Intelligence chiefs allege Russians have compromising personal information on Donald Trump: The claims allege the now-President-elect had been in contact with Russian intermediaries for five years	64068
45	“Canada will welcome you,” Trudeau invites refugees as Trump bans them	63984
46	PM Justin Trudeau of Canada announces $650 million investment in women health and reproductive rights over next three years.	63240
47	China scraps construction of 85 planned coal power plants: Move comes as Chinese government says it will invest 2.5 trillion yuan into the renewable energy sector	63138
48	The police officer who leaked the footage of the surfers paradise police brutality, where the victims blood was washed away by officers, has been criminally charged for bringing it to the publics view. Officers who did the bashing get nothing.	62150
49	Netherlands will once again need to close prisons due to falling crime rate and lack of prisoners.	62052
50	"""After 16 appearances in the Olympics, the tiny nation of Fiji has its first medal. And it is gold."""	61871
51	Donald Trump's Great Wall on Mexican border will damage environment in 'insane act of self-sabotage' - Making the cement needed for a 1,000-mile concrete wall would emit nearly two million tons of carbon dioxide and cut off endangered animals from part of their territory	61803
52	Trump bid to reinstate travel ban fails	61525
53	Pope suggests 'better to be atheist than hypocritical Catholic'	61324
54	EU will remain top investor against climate change, in defiance of Donald Trump's policies - 'We, Europeans, must lead the free world against climate sceptics'	61292
55	The United States will normalize diplomatic relations with Cuba, open embassy in Havana	61251
56	France decrees new rooftops must be covered in plants or solar panels. All new buildings in commercial zones across the country must comply with new environmental legislation	61181
57	UK government finally concedes cannabis has a medicinal effect	60769
58	Michael Flynn resigns: Trump's national security adviser quits over Russia links	60741
59	Paris makes all public transport free in battle against 'worst air pollution for 10 years'	60607
60	Kaziranga's (Indian National Park) ruthless rangers have reduced rhino poaching by simply gunning down poachers at sight	59335
61	"Oil giant Shell warns public faith in fossil fuel industry is 'disappearing' and calls for carbon taxes - ""Shell is to increase its spending on renewable energy to $1bn a year"""	59218
62	"The President of Colombia, Juan Manuel Santos, has used his Nobel Peace Prize acceptance speech to call for the world to ""rethink"" the war on drugs."	58209
63	Investors with $2.8 trillion in assets unite against Donald Trump’s climate change denial | As US President ramps up support for fossil fuels, some of the world's biggest funds demand end to coal and oil subsidies	57986
64	France Rejects Fear, Renews Commitment To Take In 30,000 Syrian Refugees	57905
65	China, Japan, Russia, & South Korea have just signed a Memorandum of Understanding that seeks to create an 'Asian Super Grid'. It will transmit electrical power from various renewable sources to areas all over the world.	57558
66	Martin Schkreli - Turing CEO who increased the price of Aids drug by 5000% - has been arrested	57225
67	Petition calling on UK to cancel Trump state visit reaches 100,000 signature in less than 5 hours.	56951
68	7.3 Magnitude Earthquake hits Fukushima, Japan. 3 Meter Tsunami warning at this time (22 November, 2016, 5:59am)	56129
69	Truck crashes into Bastille Day crowd in Nice, France	55986
70	Canada Student Loan Repayment Relief: As of November 1, no single Canadian will have to repay their Canada Student Loan until she or he is earning at least $25,000 per year	55617
71	German anti-vaccer wagers € 100,000 to anyone proving the existance of the measles virus. Researcher sends him articles proving the virus' existance and takes him to court where he's ordered to pay the full amount.	54855
72	SpaceX’s Falcon 9 rocket successfully lands upright.	54708
73	Pope Francis: There is 'no point' going to church if you don't really believe in it. Pope speaks out against 'Christian parrots' who talk about religion but don't do good deeds, and says forgiveness can be difficult but is necessary in all cases, including domestic violence.	54690
74	French newspaper Le Monde to stop publishing pictures of terrorists to avoid 'glorifying them in death	54476
75	President Trump signs an executive order to move forward construction of Dakota Access and Keystone XL pipelines.	54333
76	BBC forecasts UK votes to Leave the European Union	54309
77	More than 140,000 families cut off from childcare payments for not vaccinating their kids in Australia	54163
78	Saudi Arabia strips religious police of arresting power	54128
79	Donald Trump admits ‘Sweden attack’ comments were based on debunked 'Fox News' report	54119
80	NASA officially announces Manned Mars Mission, test launch will begin tomorrow testing orbiter.	53906
81	David Cameron to Resign as PM After EU Referendum	53836
82	Munich mayor extends Oktoberfest invite to US President Barack Obama -- The outgoing US president has said he would like to visit Germany's famed beer festival as a private citizen. Now, the mayor of Munich has welcomed him to do just that	53303
83	Judge presiding over 'El Chapo's' case shot, killed while jogging outside home	52727
84	"The Dalai Lama on terrorist attacks: ""We cannot solve this problem only through prayers. ... I believe in praying. But humans have created this problem, and now we are asking God to solve it. It is illogical. So let us work for peace ... and not expect help from God, Buddha or the governments."""	52627
85	Donald Trump's claims his team had no contact with Russia during campaign contradicted by Moscow officials	51944
86	British officials drop plans for Donald Trump to address parliament	51896
87	"Pope Francis refused to equate Islam with violence saying Catholics could be just as deadly & warning Europe was pushing its young to terrorism. ""I don't think it is right to equate Islam with violence. In almost every religion there's always a small group of fundamentalists. We have them too."""	51871
88	Haitians are urging people not to give money to the Red Cross	51610
89	"Indian Prime Minister: ""I want to tell the people of Pakistan, India is ready to fight you. If you have the strength, come forward to fight against poverty. Let's see who wins. Let's see who is able to defeat poverty and illiteracy first, Pakistan or India."""	51501
90	In Big Win For Big Cats, China Approves National Park Larger Than Yellowstone	51189
91	Shell launches bid to leave massive, sludgy oil rig remnants in North Sea for 500 years - 'Oil and gas companies operating in the North Sea have a legal, as well as moral, obligation to clean-up their mess,' says leading environmentalist	51134
92	South Korea: President Park Geun-hye Impeached	51027
93	U.S. expels 35 Russian diplomats, closes two compounds: official	50998
94	Canadians elect Liberal majority. Ending Stephen Harpers 9 year rule.	50955
95	Mexico said it will not pay for a border wall	50901
96	Body of Russian soldier who called in an airstrike on himself after being surrounded by IS fighters has been recovered. He was posthumously awarded the Hero of Russia medal.	50765
97	US student declared dead actually 'kidnapped to teach English to Kim Jong-un'	50685
98	UK admits it spied illegally for 17 years, is sorry, won't stop	50337
99	President Vladimir Putin on Thursday accused American politicians of whipping up hysteria about a mythical Russian threat as a ploy to distract voters from their own failings in the run-up to the U.S. presidential election.	50106
100	Uber drivers in the UK have won an employment tribunal case which ruled they are workers rather than self-employed. This means they are entitled to Holiday Pay and a minimum wage	49622
101	14 year old Boy from India made a Anti-Landmine Drone which can detect and defuse has signed a 5 crore rupees deal (50 million rupees) for production with the Indian Government	49101
102	Israel officially decriminalizes marijuana use	48881
103	Norway considers giving mountain to Finland as 100th birthday present - Norwegian government considers shifting border to gift its Nordic neighbour a peak that would become its highest point	48713
104	Trump told Australian Prime Minister refugee agreement was the 'worst deal ever' and phone conversation was ‘worst call by far’ he had had with world leaders.	48644
105	"Putin praises Obama for admitting mistakes in Libya: ""Firstly, this fact confirms once again that the current US president is a decent person"""	48520
106	Every reference to the Great Barrier Reef removed from UN report on impact of climate change after ‘intervention’ from Australian government.	48484
107	North Korea Has Accidentally Enabled Outside Access to its Propaganda Websites	48469
108	Rex Tillerson: Secretary of State used fake name ‘Wayne Tracker’ to discuss climate change while Exxon Mobil CEO: Court filing comes in legal dispute in which Exxon seeks to derail probes into whether the company misled investors for years about the possible impact of global warming on its business	48301
109	Shots fired in Quebec City Mosque	48300
110	"Cook fired for ""stealing"" 50c worth of french fries from Burger King is awarded $46k settlement."	48284
111	U.S. Ambassador To UN Says No Lifting Of Russia Sanctions Until Crimea Returned	47801
112	Elon Musk says the solar roof that will be sold under a combined Tesla-SolarCity will likely cost less than a normal roof to install.	47754
113	Toys R Us yesterday opened its UK stores for a “quiet hour” designed to accommodate the needs of children with autism. Measures included dimmed fluorescent lighting and a ban on music and in-store announcements.	47504
114	After mass protests, Poland won't back total abortion ban	47406
115	Truck ploughs into Christmas market in Berlin, injuring several people – reports	47355
116	Reports of explosions at Brussels airport	47266
117	"""We Won't Block Pirate Bay,"" Swedish Telecoms Giant Says"	47019
118	Elephants trample poacher to death, another poacher seriously injured	46858
119	Canada this month took steps toward joining the United States in banning the sale of personal-hygiene products that contain tiny plastics known as microbeads.	46776
120	"The giant panda is no longer an endangered species, following decades of work by conservationists to save it. The official status of the much-loved animal has been changed from ""endangered"" to ""vulnerable"" because of a population rebound in China."	46719
121	Vancouver slaps $10,000 a year tax on empty homes. Lie about it and it’s $10,000 a day	46680
122	Six people who hid in a supermarket refrigerator during January's Islamist attacks in Paris have sued French media for broadcasting their location live during the siege	46432
123	The suspect in the deadly attack on a Quebec City mosque was known in the city’s activist circles as a right-wing troll who frequently took anti-foreigner and anti-feminist positions and stood up for U.S. President Donald Trump.	46306
124	Swedish kids to learn computer coding and how to spot fake news in primary school	46209
125	Explosion At Airport In Istanbul	46148
126	Australian high school students have created 3.7 grams of an active ingredient used in the medicine Daraprim for $20, which would sell in the United States for between $US35,000 and $US110,000.	46030
127	Petition asks US President, Congress, DoD not to bomb Tinian and Pagan islands for military training. The US Navy has plans to bomb these islands as part of a training exercise, obliterating their rare coral ecosystems, wildlife, and important historic artifacts.	46012
128	Scotland considers legally enshrining the 'right to food': '...it would mean the Government and other public bodies would have a duty to ensure everyone has secure access to adequate and affordable food.'	45798
129	China Tells Trump That Climate Change Is No Hoax It Invented	45540
130	Pope has urged having fewer children if “you cannot bring them up properly,” claims Vatican academy member	45510
131	Body count rises as new Philippines president calls for drug addicts to be killed	45474
132	A day without murder: no one is killed in El Salvador for first time in two years	45344
133	There will be a huge new 'Panama Papers' data dump on May 9th	45297
134	A man who sought asylum in the US more than two decades ago, graduated from the University at Buffalo and worked for the New York State Department of Transportation has just been elected president in his homeland of Somalia	45256
135	Leading Climate-Denier Harvard Scientist Caught Accepting Bribes from Fossil-Fuel Corporations as well as the Koch Brothers.	45214
136	Donald Trump 'to sign orders restricting refugee access and immigration from Muslim countries'	45146
137	"47 of the world's poorest countries are aiming to hit 100% renewable energy - ""The idea is ... to skip from pre-industrialisation to renewables, avoiding the 'messy part' in the middle where a need for more energy to support economic growth spurs fossil fuel use to dangerously high levels."""	44989
138	Iceland's capital Reykjavik to switch off street lights tonight due to a forecast of unusually magnificent northern lights	44965
139	Taiwan set to legalize same-sex marriages, a first in Asia	44896
140	Jordan has a population of 6 million, but have taken in 1.5 million refugees. All with little protest or mass global coverage.	44779
141	"US sanctions Iran after missile test, But Iran has said it will not yield to ""useless"" American threats from ""an inexperienced person""."	44540
142	US funding for Great Lakes cleanup could be slashed by 97%, leaked document shows	44440
143	London breaches annual air pollution limit for 2017 in just five days | Environment	44420
144	German footballer Mesut Ozil donated his €300,000 World Cup victory bonus to pay for surgery of 23 children in Brazil	44351
145	In a bid to stop the killing of elephants for their tusks, world governments voted at a major conservation conference to urge the closure of all domestic ivory markets. After fierce debate -- including opposition from governments like Namibia and Japan -- the motion was adopted.	44346
146	Solar was the cheapest source of electricity in 2016, and it will further undercut fossil fuels in 2017	44214
147	Iraqis Use 9/11 Bill to Demand Compensation from US for 2003 Invasion	44147
148	"The UN just declared antibiotic resistance “the greatest and most urgent global risk""."	44126
149	French president pardons woman convicted of killing her husband after he abused her and their children for 47 years.	44055
150	After almost 18 years of circling Earth, the International Space Station completed its 100,000th orbit on Monday.	44019
151	President Donald Trump personally approved a US commando raid in Yemen that left one elite serviceman dead and may have killed an eight-year-old American girl, the US military has told the Guardian.	43979
152	President Obama commutes the majority of Chelsea Manning’s prison sentence	43903
153	More than 100,000 students in Bangladesh protest against rise of Islamic extremism	43831
154	Two-thirds of Britons believe Trump is 'threat to international stability'	43799
155	A judge who asked an alleged rape victim why she “couldn’t keep her knees together” is facing a public hearing to keep his job in Canada	43791
156	Trump Calls NATO Obsolete and Dismisses EU in German Interview	43787
157	A 117-year-old woman in Mexico City finally received her birth certificate, and died a few hours later. Trinidad Alvarez Lira had waited years for proof that she had been born in 1898.	43754
158	US Defence Secretary James Mattis says climate change is already destabilising the world	43663
159	Trump Reverses Pledge To Mandate U.S. Steel For Keystone Pipeline. A Direct Beneficiary Is A Russian Oligarch With Close Ties To Vladimir Putin	43576
160	Doctors in Denmark want to ban circumcision for under-18s	43530
161	EU reaches mobile roaming deal that will allow EU citizens to use their mobile phones throughout every EU country without paying roaming fees	43468
162	2 Chinese poachers jailed 30 yrs for slaughtering 226 elephants	43351
163	Elon Musk plans to get humans to Mars in six years: SpaceX founder tells meeting of astronautical experts that his only purpose is to ‘make life interplanetary’, revealing plans for reusable ship to Mars	43289
164	Russia has warned North Korea that threats to deliver “preventive nuclear strikes” could create a legal basis for the use of military force against the country	43155
165	German arms manufacturer giant Heckler & Koch to stop doing deals with undemocratic countries or countries not under NATO-influence, ruling out deals with countries such as Saudi Arabia and Turkey	43047
166	Video showing 'London Muslims celebrating terror attacks' is fake. The footage actually shows British Pakistanis celebrating a cricket victory in 2009.	43046
167	"The president of the Philippines Rodrigo Duterte should be investigated for murder after boasting he ""personally"" killed three suspected criminals, a top United Nations official said."	43042
168	UN denounces Trump's travel ban as 'mean-spirited' and illegal under human rights law - 'Discrimination on nationality alone is forbidden under human rights law'	42830
169	Pope: It's 'terrible' kids taught they can choose gender	42784
170	Edward Snowden Mocks Cameron For Sudden Interest In Privacy After Panama Papers Leak	42746
171	Brazil's Supreme Court has banned corporate contributions to political campaigns and parties	42664
172	Canada to become first G7 nation to legalize marijuana: government	42663
173	Adidas shoe manufacture returns to Germany, fully automated instead of relying on human labour in Asia	42651
174	UK: New drivers who are caught using a phone at the wheel will lose their licence under new legislation that comes into force today.	42648
175	German parliament legalises cannabis for medical consumption	42622
176	Shots fired at Parliament in Canada	42511
177	Nightclubs to offer free drug-testing booths to check purity of cocaine and MDMA	42392
178	Swedish military and foreign-affairs officials have said they know nothing about a man who appeared on Fox News in the US billed as a “Swedish defence and national security advisor”.	42366
179	Mexico's 'avengers' backed by public sick of crime and lack of punishment: A wave of vigilante killings – such as the bus passenger who shot four robbers – has struck a chord with Mexicans fed up with crime, corruption and impunity	42133
180	China introduces progressive sex ed curriculum, includes pro LGBTQ+ comments and gender equality.	41893
181	It's now illegal in England and Wales to smoke in cars with kids inside	41890
182	Both of Istanbul's Bosphorus bridges are closed	41860
183	"Drug lord Joaquin ""El Chapo"" Guzman has been extradited from Mexico to the United States, foreign ministry says"	41791
184	Germany recognizes the Armenian Genocide	41787
185	"Pope Francis said Monday that ""many powerful people don't want peace because they live off war"". ""Some powerful people make their living with the production of arms. It's the industry of death""."	41766
186	"British govt poo-poos winning 'Boaty McBoatface' name for ship - After Internet users overwhelmingly voted to christen Britain's new $300 million research ship ""Boaty McBoatface"" in an online naming poll, a govt official suggests the name won't be used."	41760
187	France Drops 20 Bombs On IS Stronghold Raqqa	41634
188	Russia tells White House it will not return Crimea to Ukraine	41546
189	Pope tells women to feel free to breastfeed in church	41458
190	Speedo USA Drops Sponsorship of Ryan Lochte Amid Scandal, donates Lochte's $50k fee to children in Brazil	41375
191	MP Jo Cox dead after shooting attack	41364
192	Berlin mayor to Donald Trump: 'Don't build this wall'	41363
193	Peru's President Tells Trump He Prefers 'Bridges to Walls'	41310
194	'Shots fired' in Munich shopping centre	41245
195	Costa Rica celebrates 113 days of 100-percent renewable energy (and counting)	41221
196	Donald Trump state visit: MPs of all parties demand 'disgusting' US President's trip be cancelled | Debate in Westminster Hall triggered after a petition to block state visit reaches almost two million signatories	41212
197	"""Copyright is not a divine right"" - Indian court rules in favour of photocopying college textbooks."	41100
