198	Canadian Prime Minister's office asks Fox News to retract 'misleading' tweet about Quebec mosque shooting	41031
199	‘Alan Turing law’ unveiled by government will posthumously pardon thousands of gay men convicted of historic offences: The Enigma codebreaker's great neice says Government decision is 'absolutely tremendous'	41019
200	Iraq to hang 36 ISIS fighters for massacre of 1,700 captives who were told they were going home	40988
201	Mikhail Gorbachev: 'It All Looks As If the World Is Preparing for War'	40945
202	Russian soldier surrounded by ISIS calls in airstrikes on himself	40910
203	$122 Million in Cash Found in Apartment Belonging to Acting Head of Russia's Anti-Corruption Agency	40808
204	Police were called when a protest erupted at a school in North Yorkshire after students were limited to two toilet breaks a day.	40753
205	Switzerland Votes to Keep Nuclear	40537
206	Malaysian Plane crashes over the Ukraine	40522
207	Donald Trump says he wants to expand US nuclear arsenal, make it 'top of the pack'	40503
208	"A gay couple has been detained by Moscow police in Russia after leaving flowers and a sign with ""Love wins"" written on it outside the US embassy. Russian law bans protests over gay rights, and LGBT people in the country suffer severe discrimination and homophobia."	40492
209	China wants to give all of its citizens a score – and their rating could affect every area of their lives: The Communist Party wants to encourage good behaviour by marking all its people using online data. Those who fall short will be denied basic freedoms like loans or travel	40465
210	"Apple co-founder Steve Wozniak says the NSA whistleblower “gave up his own life . . . to help the rest of us""."	40397
211	King of Sweden stresses need for ‘serious’ media and source checking after Donald Trump’s immigration claims	40397
212	Russia challenges US to prove election hacking claims or shut up	40318
213	Slovenia adds water to constitution as fundamental right for all	40269
214	Police will be deployed to a village in Mexico after an invitation to a girl's birthday party went viral and 1.2 million people said they would attend.	40250
215	Norway pledges $10 million to counter Trump's global anti-abortion move	40210
216	France has become the first country in the world to ban supermarkets from throwing away or destroying unsold food, forcing them instead to donate it to charities and food banks.	40115
217	Huge explosion reported in Chinese port city of Tianjin	40011
218	"Saudi prince to give away $32bn. He said he had been inspired by the Gates Foundation, set up by Bill and Melinda Gates in 1997. The money would be used to ""foster cultural understanding"", ""empower women"", and ""provide vital disaster relief"", among other things, he said."	39905
219	India sues Nestle for nearly $100m because lead shouldn't be in noodles.	39844
220	'Many wounded' in Istanbul nightclub attack	39778
221	Isis to be cut off from rest of world 'within hours' as Turkish-backed rebels close in	39716
222	Egyptian state media claims 9/11 was carried out by West to justify war on terror	39658
223	CCTV captures the moment 'an election official stuffs a pile of voting papers in to a ballot box' in Russia as Putin's party sweeps to victory amid claims of vote-rigging	39648
224	Declassified documents detail 9/11 commission's inquiry into Saudi Arabia, Chilling story of the Saudi diplomat who, many on the commission’s staff believed, had been a ringleader of a Saudi government spy network inside the US that gave support to at least two of the 9/11 hijackers	39649
225	David Cameron personally intervened to prevent tax crackdown on offshore trusts	39588
226	SpaceX successfully lands its rocket on a floating drone ship for the first time	39448
227	Saudi women file petition to end male guardianship system - BBC News	39412
228	Exclusive - Trump border 'wall' to cost $21.6 billion, take 3.5 years to build: Homeland Security internal report	39361
229	Beijing has issued its first ever ‘Red Alert’ over smog, and the city is going into complete shutdown	39357
230	German government agrees to ban fracking indefinitely	39314
231	Airstrike destroys Doctors Without Borders hospital in Aleppo, killing staff and patients	39294
232	Swedish embassy offers to 'inform' Donald Trump on country's immigration and integration policies	39280
233	A Chinese billionaire may have hidden 6% of the world's aluminum in the Mexican desert	39230
234	Pope says Church should ask forgiveness from gays for past treatment	39176
235	NASA has completed the $8.7 billion James Webb space telescope - Hubble's successor is ready for testing ahead of the October, 2018 launch - It's equipped with a 21-foot, gold-coated mirror array that can collect seven times more light than Hubble and scan the infrared spectrum to see through dust.	39100
236	Wikipedia bans the Daily Mail as a source for being 'unreliable'	39085
237	The solar system appears to have a new ninth planet. Today, two scientists announced evidence that a body nearly the size of Neptune—but as yet unseen—orbits the sun every 15,000 years.	39053
238	China declares war on ISIS after terrorists 'execute Chinese hostage'	39039
239	France warns Belgium not to print €2 coin commemorating French defeat at Waterloo, so Belgium prints it on a €2.50 coin instead	38668
240	Ontario parents who object to vaccines could be forced to take a class in science of immunization.	38648
241	Eating Endangered Species Is Now Illegal In China	38646
242	Scientists have identified that mysterious, metallic sound coming from the Mariana Trench - According to a new study, the eerie 3.5-second recording that was picked up by an autonomous vehicle deep in the Mariana Trench is a new type of baleen whale call that no one has ever heard before	38603
243	Swiss politician says hijab should be banned from passports - claims it is 'unequal treatment' that headscarves are allowed in passport photos while headbands and caps are not	38603
244	Donald Trump confuses French translators with mixed-up speeches: 'Trump’s vocabulary is limited, his syntax is broken; he repeats the same phrases over and over'	38600
245	Italy passes law to encourage all supermarkets to give unsold food to needy: 'The food currently wasted in Europe could feed 200 million people,' says the UN Food and Agricultural	38578
246	Women burn burqas, men cut beards as Syrian town celebrates IS ouster	38493
247	Donald Trump appears to invent Sweden terror attack during Florida rally speech	38458
248	In hurry-up mode while Obama is president, 60 nations have agreed to global climate accord	38414
249	NASA discovers another Earth like planet in the Milky Way galaxy - Planet Kepler-452b, the first near-Earth-size world to be found in the habitable zone of star that is similar to our sun.	38273
250	Canada's highest court upholds ruling that Donald Trump did mislead investors	38268
251	Bing translates “Daesh” as “Saudi Arabia”, angers entire Kingdom	38196
252	Yahoo discloses hack of 1 billion accounts	38193
253	An Iraqi man, Naijh Al-Baldawi hugs ISIS suicide bomber absorbing the blast. Saving the targeted shine and countless lives.	38151
254	Malaria vaccine discovered	38073
255	Jeremy Corbyn calls for Donald Trump to be banned from UK visit until Muslim ban is lifted	38063
256	Thousands of Russians packed streets in Moscow on Sunday to mark the second anniversary of Putin critic Boris Nemtsov's death. Nemtsov, 55, was shot in the back while walking with his Ukrainian girlfriend in central Moscow on February 28, 2015.	38056
257	EgyptAir Flight MS804 disappears from radar during Paris-Cairo flight	38025
258	Worst-ever coral bleaching event goes into unprecedented 4th year: Sea surface temperatures are so high that Australia divers are already reporting new bleaching in the part of the Great Barrier Reef where last yr 1/2 of corals died.	37995
259	German politicians approve new law making it illegal to have sex with prostitutes without a condom	37993
260	German Vice Chancellor Gabriel:'Saudi Arabia must stop financing Wahabi Mosques throughout the world. They are a breeding ground of Terrorism. In Germany many extremists considered dangerous persons emerge from these communities. I say to them that the time of looking the other way is over.'	37927
261	Chinese foreign minister: In a fight between China and the US 'both sides will lose and both sides cannot afford that'	37872
262	Obama cancels meeting with new Philippine President Duterte	37819
263	Paris attacks: The eight terror suspects named so far are not refugees and all have EU passports	37794
264	UAE's Sheikh Mohammed fills his private plane with $354,000 of supplies and sends to Haiti	37769
265	Quebec Judge issues $1 fine for possessing 30 cannabis plants, calls marijuana laws obsolete	37733
266	Teen girl sent by Boko Haram rips off suicide vest, refuses to bomb refugee camp	37670
267	China censors Panama Papers online discussion	37647
268	The richest 1% of Indians now own 58.4% of wealth	37570
269	Pharmaceuticals CEO who raised HIV drug price by 5,000% 'also hiked cost of pill taken by children with incurable kidney disease'	37527
270	British neo-nazi group 'to be classed as terror organisation and banned' in unprecedented move	37487
271	Canada Legalizes Physician-Assisted Dying	37442
272	Russian ambassador to Ankara Andrey Karlov attacked by unidentified gunmen	37421
273	The US state department has instructed New York City's chief medical examiner not to disclose the cause of death of Russia's ambassador to the United Nations	37422
274	We just broke the record for hottest year, 9 straight times | Earth’s record hottest 12 consecutive months were set in each month ending in September 2015 through May 2016	37327
275	Immigrants should be made to learn English on arrival to help integration in UK, parliamentary report finds	37324
276	"Britain just passed the ""most extreme surveillance law ever passed in a democracy"""	37308
277	Russia has secretly deployed a cruise missile that violates an arms treaty: NYT report	37126
278	Sepp Blatter resigns. Calls for new election.	37020
279	Trump administration 'had a secret plan to lift Russian sanctions' and cede Ukraine territory to Moscow	36935
280	Australian nurses who spread anti-vaccination messages face prosecution	36919
281	South Korean President Park Geun-hye has called on North Koreans to abandon their country and defect, just a day after a soldier walked across the heavily fortified border into the South	36840
282	Entire internet history of UK citizens to be viewable by government bodies including police, tax agencies, pensions body, and Food Standards Agency within weeks	36813
283	The largest strike in human history is taking place in India. 180 million members of large unions are protesting against privitization.	36757
284	Justin Trudeau has officially ordered Canada's Justice Minister to start the weed legalization process	36667
285	"A leading member of a group advising Pope Francis on how to root out sex abuse in the Catholic Church quit in frustration on Wednesday, citing ""shameful"" resistance within the Vatican."	36432
286	"France will press its G7 partners this month to launch an ""irreversible"" process to control the prices of new medicines, part of a global drive to make life-saving drugs more affordable"	36426
287	David Cameron admits he did have a stake in father Ian Cameron's offshore investment fund	36391
288	Saudi Arabia has told the Obama administration that it will sell off hundreds of billions of dollars’ worth of American assets held by the kingdom if Congress passes a bill that would allow the Saudi government to be held responsible in American courts for any role in the Sept. 11, 2001, attacks.	36388
289	Rio Olympics: US swimmer Ryan Lochte and three others robbed - BBC News	36290
290	Cocaine with a street value of up to 50 million euros (£42m) has been discovered at a Coca-Cola plant in France.	36251
291	North Korean leader Kim Jong-un's half-brother killed in Malaysia, say reports	36237
292	CIA says Russia intervened to help Trump win White House: Washington Post	36227
293	White House reverses travel ban on green card holders	36138
294	At least 83 killed, 176 wounded in separate bombings across Baghdad	36113
295	UN: “We are well on our way to the sixth global extinction of species in the history of the planet, and States are still failing to halt the main drivers of biodiversity loss, including habitat destruction, poaching and climate change.”	36112
296	Super-rich Swiss village opts for £200,000 fine instead of accepting 10 refugees	36106
297	South Sudan president says soldiers who rape should be shot	36081
298	Barrel of Oil now cheaper than an actual Barrel to put the oil in.	36034
299	Greek news sites are reporting that Aristotle's tomb was found.	35989
300	China announces sanctions on North Korea	35980
301	Ten dead, 30 injured in blast outside park in Pakistan's Lahore	35971
302	Thousands sign petition for royal family to pay for Buckingham Palace repairs themselves	35963
303	Montreal police tracked journalist's iPhone: “I was living in the fiction that police officers wouldn’t dare do that, and in the fiction that judges were protecting journalists -- and hence the public -- against this type of police intrusion,” Lagace said. “Clearly, I was naive.”	35906
304	Ten african countries vow to recreate 100 million hectares of lost jungle, twice the size of Europe. World bank & Germany announces funding	35854
305	Pope Francis reveals new church law to deal with paedophile priests: Catholic bishops who fail to sack paedophile priests can be removed from office	35763
306	Two-thirds of Australians think reef crisis is 'national emergency' – poll: Overwhelming majority of people agree the government should legislate to stop chemicals polluting the Great Barrier Reef	35730
307	Legal Weed sales in Canada expected to surpass alcohol	35724
308	Rio chefs use leftover Olympic food to feed the poor	35713
309	"US Journalist, James Foley, beheaded by ISIS ""Warning to America""."	35665
310	Many millions of Muslims 'fundamentally incompatible with the modern world', says Tony Blair	35601
311	North Korean elite is turning against Kim Jong-un, says defector	35598
312	Microsoft Corp said on Wednesday it will begin warning users of its Outlook.com email service when the company suspects that a government has been trying to hack into their accounts.	35577
313	U.N. Chief Admits He Removed Saudi Arabia From Child-Killer List Due to Extortion	35556
314	Billionaire hedge fund managers have called on Puerto Rico to lay off teachers and close schools so that the island can pay them back the billions it owes. It accused the island, where 56% of children live in poverty, of spending too much on education	35464
315	Former Controversial Toronto Mayor Rob Ford Has Died	35452
316	Alexandre Bissonnette identified as suspect in #QuebecShooting. Mohamed Khadir, originally identified as a suspect, has now been named as a witness.	35412
317	Highest-paid CEOs run worst-performing companies, research finds	35347
318	Subway has announced its intention to sue the Canadian Broadcasting Corporation alleging the network aired a program falsely claiming the company’s chicken contains around 50 percent soy. The CBC refuses to retract its claim or apologize.	35298
319	Massive paedophile ring uncovered by police in Norway after arrest of 51 men	35223
320	South Korea says it will send aid to North Korea during its worst drought in a century under one condition -- just ask for it	35227
321	Former MI6 agent Christopher Steele's frustration as FBI sat on Donald Trump Russia file for months: Steele was so concerned by revelations he worked without payment after Trump's election victory in November	35215
322	Another drug Cycloserine sees a 2000% price jump overnight as patent sold to pharmaceutical company. The ensuing backlash caused the companies to reverse their deal. Expert says If it weren't for all of the negative publicity the original 2,000 per cent price hike would still stand.	35188
323	Mass protest in Seoul against South Korean President	35139
324	WikiLeaks publishes docs showing that the NSA bugged meetings between Ban Ki-Moon and Merkel, Netanyahu, Berlusconi, between key EU and Japanese ministers discussing their secret trade red-lines at WTO negotiations, as well as details of a private meeting between Sarkozy, Merkel and Berlusconi	35140
325	"Church of the Flying Spaghetti Monster conducts legal wedding in New Zealand - A pastarafian couple in New Zealand has become the first to ""tie the noodly knot"" in a legally recognized ceremony officiated by an ordained ""ministeroni"" from the Church of the Flying Spaghetti Monster."	35049
326	India Has Planted Nearly 50 Million Trees In 24 Hours	34913
327	Ed Miliband says Panama Papers show ‘wealth does not trickle down’	34872
328	Vaping is 95% safer than smoking and could lead to the demise of the traditional cigarette, Public Health England (PHE) has said in the first official recognition that e-cigarettes are less damaging to health than smoking tobacco.	34871
329	Australia has the most expensive internet in the world because big players Telstra and Optus are so powerful they can charge huge rates, an internet security company claims	34847
330	After convincing China to give up shark fin soup, Yao Ming sets out to save Africa's elephants from the ivory trade	34795
331	France to force big supermarkets to give away unsold food to charity	34786
332	Powerful 7.4 earthquake strikes near Christchurch, New Zealand - BBC News	34753
333	Canada should allow people aged 18 and up to buy recreational marijuana through a wide range of retail options, according to a government-commissioned report that lays out groundwork for legalizing the drug.	34716
334	Volkswagen has admitted to using software on VW and Audi branded cars to cheat U.S. diesel emissions tests, shares plunge more than 20 percent.	34716
335	Bus full of Chinese basketball reporters caught in roadside gunfight on the way to Olympic Village in Rio	34640
336	Every Month This Year Has Been the Hottest in Recorded History	34550
337	Obama rejects Keystone XL project, citing climate concerns	34550
338	Julian Assange's internet link has been intentionally severed by a state party	34538
339	UK Bristol police taser their own black race relations adviser after mistaking him for wanted man	34522
340	"UN experts denounce 'myth' pesticides are necessary to feed the world. The report says pesticides have “catastrophic impacts on the environment, human health and society as a whole"""	34524
341	Brazilian congress votes to impeach president Dilma Rousseff	34481
342	'Hangover-free alcohol’ could replace all regular alcohol by 2050. The new drink, known as 'alcosynth', is designed to mimic the positive effects of alcohol but doesn’t cause a dry mouth, nausea and a throbbing head	34468
343	$100B invested in wind or solar will now produce more energy than the same investment in oil	34454
344	"Pope washes feet of Muslim migrants, says ‘We are brothers’ ""In his homily, Francis said: 'We have different cultures and religions, but we are brothers and we want to live in peace.'"""	34423
345	BP CEO to get $3.3 million raise after 12,000 layoffs	34403
346	Germany Just Abolished College Tuition Fees | ThinkProgress	34382
347	WikiLeaks releases 300k Turkey govt emails in response to Erdogan’s post-coup purges	34297
348	Danish green energy giant Dong said on Thursday it was pulling out of coal use, burning another bridge to its fossil fuel past after ditching oil and gas. Dong is the biggest wind power producer in Europe.	34267
349	Paris will cut the number of cars on the road in half beginning Monday and is making public transit free to combat a spike in pollution that has obscured even the Eiffel Tower under a smoggy haze	34258
350	'I should have used both hands': German minister defends giving neo-Nazi protesters the finger	34251
351	"The robots sent into Fukushima have ""died"". As soon as they get close to the reactors, the radiation destroys their wiring and renders them useless,"	34226
352	Wife of hospitalized Putin critic: My husband was poisoned	34192
353	"19-year-old female Kurdish fighter Asia Ramazan Antar has been killed when she reportedly tried to stop an attack by three Islamic State suicide car bombers | Antar, dubbed ""Kurdish Angelina Jolie"" by the Western media, had become the poster girl for the YPJ."	34138
354	Stephen Hawking announces $100 million hunt for alien life	34078
355	"Pope condemns ""bloodsuckers"" who exploit poor workers: Pope says making ""slaves"" out of workers and setting unfair contracts is a mortal sin"	33987
356	Philippines will offer free birth control to 6 million women.	33923
357	Suicide bomber hits stadium in Iraqi city, killing 29	33923
358	Scientists are frantically copying US climate data, fearing it might vanish under Trump	33888
359	Donald Trump presidency a 'disaster for the planet', warn climate scientists: 'At the heart of his energy and climate thinking is an “America first” policy where “draconian climate rules” are repealed and the US escalates its production of coal, oil and natural gas.'	33855
360	'Extreme surveillance' becomes UK law with barely a whimper	33833
361	BP platform leaks 95 tonnes of oil into North Sea	33830
362	Exxon knew of climate change in 1981, email says – but it funded deniers for 27 more years	33813
363	North Korea's internet is offline; massive DDOS attack presumed	33810
364	England bans smoking in cars containing children.	33802
365	Toronto Muslim police chaplain says women commit 'major sin' if they refuse to have sex with husbands: Canadian Council of Muslim Women says comments are 'appalling' and 'really set us back'	33756
366	Irish leader doesn’t regret calling Trump “racist and dangerous”	33638
367	Just miles from the US border, Lexmark fires 90 long-term employees who asked for their pay to be increased by 6 pesos to 120 pesos ($7) a day.	33577
368	New EU rules will remove ‘geoblocking’ so customers can use online subscription services, like Netflix, abroad	33554
369	Brexit: Government rejects petition signed by 4.1 million calling for second EU referendum	33446
370	Doctors Without Borders refused a donation of one million vaccine doses from Pfizer: The heart of the refusal—which could well imperil children who would have received those vaccines—is a principled stand against the extremely high cost of many vaccines.'	33300
371	Homeopathy found to be effective for 0 out of 68 illnesses: a systematic review concluded the controversial treatment was no more effective than placebo drugs	33305
372	Panama Papers reveal London as centre of 'spider's web'	33286
373	Obama: I think Sony made a mistake by pulling 'The Interview'	33218
374	Alzheimer's disease breakthrough as new drug clears toxic proteins from brains of patients	33213
375	Mexican President 'Considering' Canceling Trip to Washington Amid Border Wall Order	33194
376	From CNN: SpaceX to fly two space tourists around the moon in 2018	33188
377	"France threatens to walk away from TTIP negotiations saying a ""total lack of transparency"" in TTIP talks poses a ""democratic problem""."	33117
378	"One Million sign petition to stop Trump UK visit - Theresa May rejects calls for it to be cancelled as a ""populist gesture"""	33022
379	Full text of the TPP has just been released.	33022
380	Archaeologists have discovered a 200 year old underground pub in Manchester, England. Unopened bottles of Brandy are among the haul	33007
381	UK government must consult Parliament before triggering Article 50 to leave EU, High Court rules	32959
382	Putin: Russia will not expel anyone in response to US sanctions	32964
383	Brazilian radio host famous for exposing corruption in his city murdered while broadcasting live on the air by two gunmen.	32946
384	Great Barrier Reef Undergoing a 'Complete Ecosystem Collapse,' Scientists Say	32929
385	Iceland’s president turns down a monthly pay increase of 5,300 USD	32904
386	Four rangers that protect elephants in Africa killed by poachers.	32856
387	Mexicans Launch Boycotts of U.S. Companies in Fury at Donald Trump	32847
388	‘Shell knew’: oil giant's 1991 film warned of climate change danger	32834
389	German push to ban combustion-engine cars by 2030 wins support	32716
390	El Chapo has been caught	32684
391	Afghan woman kills 25 Taliban rebels to avenge her son’s murder	32627
392	China's navy seizes unmanned US Navy vehicle in international waters of South China Sea	32593
393	Paris city police commissioner arrived at Bataclan before special forces. Ran in alone, took out one of the gunmen.	32539
394	Anonymous said Saturday it has uncovered information about Islamic State group attacks in Paris as well as on locations in the U.S., Indonesia, Italy and Lebanon, all apparently set for Sunday	32529
395	Today The United Kingdom decides whether to remain in the European Union, or leave	32507
396	Air France's gay stewards refuse to go to Iran, where homosexuality is punishable by death	32476
397	Paris shooting survivor suing French media for giving away his location while he hid from shooters	32468
398	US reporters praise German journalists for questioning Trump	32439
399	Anti-surveillance clothing aims to hide wearers from facial recognition | Hyperface project involves printing patterns on to clothing or textiles that computers interpret as a face, in fightback against intrusive technology	32446
400	Pirate Bay Founders Acquitted in Criminal Copyright Case	32436
401	UN Removes Saudi Arabia From Human Rights Blacklist After Just A Week, Faces Backlash - Rights groups accuse UN of flip-flopping & giving into political manipulation.	32386
402	Candidate with no votes demands recount because he ‘voted for himself’	32378
